Name,Age,Info
Jaroslav Bašta,75,"Czech politician and diplomat, deputy (1996–2000, since 2021), ambassador to Russia (2000–2005), Charter 77 signatory"
Jason Sutton,56,British drag queen
Jay Robert Nash,86,"American author (The Motion Picture Guide), lung cancer"
Jean-Marie Aerts,72,Belgian guitarist (TC Matic)
Jean-Marie Haessle,84,French-American painter
Jean-Pierre Ferland,89,Canadian singer-songwriter
Jean-Pierre Giudicelli,81,"French pentathlete, Olympic bronze medallist (1968)"
Jeanine Moussier,94,French Olympic sprinter (1948)
Jeannette Sinclair,96,English soprano
Jeffrey Veregge,50,"American Klallam artist, heart attack"
Jerome J. Pollitt,89,American art historian
Jerome Mayer,93,"American politician, member of the South Dakota Senate (1973–1976, 1977–1980)"
Jerome Rothenberg,92,American poet (Technicians of the Sacred)
Jerry Abbott,81,American songwriter and record producer (Pantera)
Jerry Grote,81,"American baseball player (New York Mets, Los Angeles Dodgers, Kansas City Royals), World Series champion (1969), respiratory failure"
Jerry Labriola,92,"American politician, member of the Connecticut State Senate (1981–1983)"
Jerry Savelle,77,American televangelist and author
Jerry Tennant,86,American bobsledder
Ji Liangnian,89,Chinese chemist
Jim Hopson,73,"Canadian football player (Saskatchewan Roughriders) and executive, president and CEO of the Saskatchewan Roughriders (2005–2015), colon cancer"
Joan Hollobon,104,Welsh-born Canadian writer and journalist (The Globe and Mail)
Joanna Dworakowska,45,Polish chess player
Joe Aitken,79,"Scottish bothy ballad singer, cancer"
Joe Flaherty,82,"American actor (SCTV, Freaks and Geeks, Happy Gilmore), writer, and comedian"
Joe Kinnear,77,"Irish football player (Tottenham Hotspur, national team) and manager (Wimbledon), complications from vascular dementia"
Joe Lartey,96,"Ghanaian sports commentator (GBC, FRCN)"
Joe Sims,55,"American football player (Atlanta Falcons, Green Bay Packers, Philadelphia Eagles)"
Joe Thomas,68,"American music producer, businessman and songwriter"
Joe Viera,91,"German jazz saxophonist and educator, founder of the Internationale Jazzwoche Burghausen"
Joel Breman,87,"American epidemiologist, kidney cancer"
Joel Conarroe,89,American arts administrator
John Allen Fraser,92,"Canadian politician, speaker of the House of Commons (1986–1994)"
John Barth,93,"American writer (The Sot-Weed Factor, Giles Goat-Boy, Lost in the Funhouse)"
John Boyd,90,"British police officer, HM Chief Inspector of Constabulary for Scotland (1993–1996)"
John Buck Wilkin,77,"American singer-songwriter (""GTO"")"
John C. Martin,80,"American attorney and jurist, judge of the North Carolina Court of Appeals (1985–1988, 1993–2014)"
John Dekker,94,Dutch-born American Christian missionary
John Giles,97,"British Olympic athlete (1948, 1952).[better source needed]"
John Louis,82,English motorcycle speedway rider (national team)
John Mildren,91,"Australian politician, MP (1980–1990)"
John Moyes,77,"English cricketer (Cumberland, Suffolk)"
John O'Shea,83,"Welsh rugby union player (Cardiff RFC, British & Irish Lions, national team), pneumonia"
John Sinclair,82,"American poet, heart failure"
John Steane,92,British headmaster and archaeologist
John Warnaby,63,"British actor (Les Misérables, The Raven, Ali G Indahouse) and priest"
Johnny Macknowski,101,Russian-born American basketball player (Syracuse Nationals)
Joko Pinurbo,61,Indonesian poet
Jon Card,63,"German-born Canadian drummer (SNFU, D.O.A., Subhumans)"
Josep Maria Terricabras i Nogueras,77,"Spanish philosopher and politician, MEP (2014–2019)"
Joseph A. Bracken,94,American philosopher and Catholic theologian
Joseph Boum,34,"Cameroonian footballer (Mersin İdmanyurdu, Antalyaspor, Zira FK). (death announced on this date)"
Joseph E. Brennan,89,"American politician, governor (1979–1987) and attorney general (1975–1979) of Maine, member of the U.S. House of Representatives (1987–1991)"
Joseph Emmanuel Ackah,89,"Ghanaian politician, MP (1993–2005)"
Joseph H. McGee Jr.,95,"American politician, member of the South Carolina House of Representatives (1963–1968)"
Joseph Kurup,79,"Malaysian politician, MP (2008–2018), minister in the Prime Minister's Department (2013–2018) and four-time Sabah State MLA"
Joseph Reynders,94,"Belgian Olympic swimmer (1948, 1952)"
Josip Manolić,104,"Croatian politician, prime minister (1990–1991) and speaker of the Chamber of Counties (1993–1994)"
José Alberto Martín-Toledano,61,"Spanish politician, mayor of Malagón (1991–2003) and deputy (2011–2019)"
José Antonio Ardanza,82,"Spanish politician, lehendakari (1985–1999)"
José Luis Muñoz Soria,75,"Mexican politician, member of the Congress of Mexico City (2009–2012) and deputy (2012–2015)"
José Santa Cruz,95,"Brazilian comedian (A Praça é Nossa, Zorra Total) and voice actor"
José Trinidad González Rodríguez,80,"Mexican Roman Catholic prelate, auxiliary bishop of Guadalajara (1997–2015)"
Juan Vicente Pérez,114,"Venezuelan supercentenarian, world's oldest living man (since 2022)"
Judd Matheny,53,"American politician, member of the Tennessee House of Representatives (2002–2018)"
Julia Rausing,63,"British philanthropist, cancer"
Julius Adler,93,American biochemist
Junior Pope,39,"Nigerian actor (Professor Johnbull), drowning"
Jürgen Herzog,82,"German mathematician, heart attack"
K. G. Jayan,89,Indian Carnatic musician
K. H. Nandasena,69,"Sri Lankan politician, MP (since 2020)"
KODA,45,Ghanaian gospel singer
Kaia Arua,33,Papua New Guinean cricketer (national team)
Kaisa Korhonen,82,"Finnish theatre director, actress, and singer"
Kaj Chydenius,84,Finnish musician and composer
Kalevi Kiviniemi,65,"Finnish concert organist, heart attack"
Kamala Das,78,"Indian politician, Odisha MLA (1990–2004)"
Karen Yarbrough,73,"American politician, member of the Illinois House of Representatives (2001–2012), Cook County clerk (since 2018)"
Karl Momen,90,Swedish architect and painter
Kaset Rojananil,90,"Thai military officer, commander-in-chief of the air force (1989–1992) and supreme commander of the armed forces (1992), co-leader of the 1991 coup d'état"
Katherin Kovin Pacino,71,American actress and child advocate
Katherine Porter,82,American visual artist
Kathleen Okubo,71,Filipino journalist
Keiko Yamamoto,83,"Japanese voice actress (Chibi Maruko-chan, Osomatsu-kun, Sazae-san), sepsis"
Keith Barnes,89,"Welsh-born Australian Hall of Fame rugby league player (Balmain Tigers, New South Wales, national team), coach and commentator"
Keith Kendall,95,Australian cricketer (Victoria)
Keith LeBlanc,69,"American drummer (Little Axe, Tackhead) and music producer (""No Sell Out"")"
Keith Wainwright,79,British hairdresser
Ken Holtzman,78,"American baseball player (Chicago Cubs, Oakland Athletics, New York Yankees), World Series champion (1972, 1973, 1974), heart disease"
Kenji Tohira,83,Japanese racing driver
Kenneth W. Harrow,80,American scholar
Kevin Batiste,57,American baseball player (Toronto Blue Jays)
Kim Christensen,71,"American journalist (Los Angeles Times, The Orange County Register), Pulitzer Prize winner (1996, 2010), cancer"
Kim Jelbart,86,Australian Olympic rower (1960)
Kim Taplin,80,British poet and writer. (death announced on this date)
Klaus Otto Nagorsnik,68,German historian and quiz show contestant (Gefragt – Gejagt)
Klaus Wolfgang Niemöller,94,German musicologist
Knud Enggaard,94,"Danish politician, MP (1964–1977, 1979–1981, 1984–1988)"
Korey Cunningham,28,"American football player (Arizona Cardinals, New England Patriots, New York Giants)"
Kunwar Sarvesh Kumar Singh,71,"Indian politician, MP (2014–2019) and Uttar Pradesh MLA (1991–2007, 2012–2014), heart attack"
Käthe Sasso,98,Austrian child resistance activist
Kåre Venn,88,Norwegian forest pathologist
Landy Párraga,23,"Ecuadorian model and influencer, shot"
Larissa Salmina-Haskell,92,Russian art historian and curator
Larry Beightol,81,"American football coach (Louisiana Tech Bulldogs), complications from heart failure, dementia and diabetes"
Larry Brown,84,"American baseball player (Cleveland Indians, Oakland Athletics, Baltimore Orioles)"
Larry Lucchino,78,"American attorney and baseball executive (Boston Red Sox, Baltimore Orioles, San Diego Padres), four-time World Series champion, heart failure"
Larry Masterson,73,Irish television producer
Larry Page,86,"English pop singer, record producer (""Wild Thing""), and music manager (The Kinks, The Troggs)"
Laurence Broderick,88,British sculptor
Laurent Cantet,63,"French film director (The Class, Human Resources, Time Out), screenwriter, and cinematographer"
Laurie Adams,93,English footballer (Watford)
Lavern Ahlstrom,87,Canadian politician
Lawrence Haworth,97,American-born Canadian philosopher
Lawrence Whalley,78,British psychiatrist
Leighton James,71,"Welsh footballer (Burnley, Swansea City, national team)"
Les Hughson Jr.,85,Australian rules footballer (Fitzroy)
Lesley Hazleton,78,"British-American author and journalist, assisted suicide"
Li Xilin,93,"Chinese general, commander of the Guangzhou Military Region (1992–1996)"
Lloyd Omdahl,93,"American politician, North Dakota lieutenant governor (1987–1992)"
Lonhro,25,"Australian Thoroughbred racehorse and sire, Australian Champion Racehorse of the Year (2004)"
Lorena Velázquez,86,"Mexican actress (Santo vs. las Mujeres Vampiro, Fray Don Juan, Mujer, Casos de la Vida Real)"
Lorenzo Palomo,86,Spanish composer
Lori and George Schappell,62,American conjoined twins
Lothar Prehn,77,"German footballer (VfB Speldorf, Bayer 05 Uerdingen)"
Lou Conter,102,"American naval commander, last survivor of the sinking of the USS Arizona, heart failure"
Louiselle,77,Italian singer
Lourdes Portillo,80,"Mexican filmmaker (The Mothers of Plaza de Mayo, The Devil Never Sleeps, After the Earthquake)"
Lowell Dittmer,82,American political scientist and author
Lubert Stryer,86,American academic
Luciano Sušanj,75,"Croatian Olympic runner (1976) and politician, MP (1990–1992, 2000–2003)"
Luis Gil,48,"Spanish footballer (Logroñés, Real Murcia, Elche)"
Luis Mendoza,78,Venezuelan football player (national team) and manager (Mineros de Guayana)
Luke Fleurs,24,"South African footballer (Ubuntu Cape Town, SuperSport United), shot"
Lyle Bauer,65,"Canadian football player and executive (Winnipeg Blue Bombers), infection"
Lyndall Ryan,81,"Australian historian, cancer"
Lynne Reid Banks,94,"British author (The Indian in the Cupboard, The L-Shaped Room), cancer"
M. K. Eelaventhan,91,"Sri Lankan Tamil politician, MP (2004–2007)"
MC Conrad,52,British musician
MC Duke,58,British rapper
Ma Weizhi,94,"Chinese lieutenant general, chief of staff for the Jinan Military Region (1988–1990)"
Ma Zhanmin,91,"Chinese lieutenant general and politician, chief of staff of the People's Liberation Army Air Force (1982–1987)"
Madhukar C. Dhas,74,Indian-American singer-songwriter (Atomic Forest)
Mahammed Dionne,64,"Senegalese politician, prime minister (2014–2019)"
Mai Raud-Pähn,103,"Estonian-Swedish art historian, editor and journalist"
Mandisa,47,"American gospel singer (""Only the World"", ""Overcomer"", ""Stronger""), Grammy winner (2014)"
Marcel André Boisard,84,Swiss intellectual and diplomat
Marcel Kinsbourne,92,Austrian-born American pediatric neurologist
Marcello Costa,84,Italian-born Australian medical researcher
Marcia Colish,86,American historian
Marcos Rivas,76,"Mexican footballer (Leones Negros Guadalajara, national team), complications from hernia repair"
Marek Czakon,60,"Polish footballer (Ilves, Eintracht Trier)"
Margaret Lee,80,"English actress (I due pericoli pubblici, Letti sbagliati, The Killers Are Our Guests)"
Margaret Williams,73,British film and television director
Marian Costea,71,"Romanian Olympic ice hockey player (1976, 1980)"
Marina Vishmidt,47,American writer
Mario Menéndez Rodríguez,87,Mexican journalist (Por Esto!)
Marla Adams,85,"American actress (The Young and the Restless, The Secret Storm, Splendor in the Grass), Emmy winner (2021)"
Martin Aliker,95,"Ugandan political advisor and academic administrator, chancellor of Gulu University (2004–2014)"
Martin Chambers,59,"Scottish Roman Catholic priest, bishop-elect of Dunkeld (since 2024)"
Martin J. Wygod,84,American businessman and racehorse breeder
Martin Stephens,84,British judge
Mary V. Seeman,89,Canadian psychiatrist
Maryse Condé,90,"French novelist (Segu, Windward Heights, The Gospel According to the New World), critic and playwright"
Matti Sutinen,94,"Finnish Olympic pole vaulter (1956, 1960)"
Mawuena Trebarh,52,"Ghanaian investor, CEO of Ghana Investment Promotion Centre (2013–2017)"
Max Werner,70,Dutch singer and drummer (Kayak)
Mayte Méndez,62,"Spanish basketball coach, vascular issues"
Meg Bennett,75,"American screenwriter (The Bold and the Beautiful, Sunset Beach) and actress (General Hospital), cancer"
Mehmet Coral,77,Turkish novelist
Mehmet Güney,87,Turkish jurist and diplomat
Melissa Inouye,44,"American historian, colon cancer"
Melitha Sidabutar,23,"Indonesian singer, heart failure"
Mely G. Tan,93,Indonesian sociologist
Michael Boder,65,"German conductor (Vienna State Opera, Liceu, Royal Danish Theatre)"
Michael C. Jensen,84,American economist
Michael Cuscuna,75,"American jazz record producer and music journalist (DownBeat), co-founder of Mosaic Records, Grammy winner (1993, 1998, 2002), complications from esophageal cancer"
Michael Dewayne Smith,41,"American convicted murderer, lethal injection"
Michael Dingake,96,"Motswana politician, MP (1994–1999)"
Michael Hanna,97,English cricketer (Somerset) and rugby union player (Bath)
Michael J. Roads,87,English-born Australian author
Michael Tanner,88,British philosopher and opera critic
Michael Verhoeven,85,"German film director (Die Weiße Rose, o.k., The Nasty Girl), screenwriter and producer"
Michael Ward,57,"American musician (The Wallflowers, School of Fish), complications from diabetes"
Mike Kolen,76,"American football player (Miami Dolphins), Super Bowl winner (VII, VIII)"
Mike Pinder,82,"English Hall of Fame musician (The Moody Blues) and songwriter (""The Best Way to Travel"", ""A Simple Game"")"
Milan Žurman,63,"Slovene football player (Maribor, Rudar Velenje) and manager (Kapfenberger SV)"
Miron Sycz,64,"Polish teacher and politician, MP (2007–2015)"
Mister Cee,57,"American DJ (WNBM), complications from diabetes"
Mohammad Reza Zahedi,63,"Iranian military officer, commander of NEHSA (2005–2006) and NEZSA (2006–2008), airstrike"
Mohammed Hanif Omar,85,"Malaysian police officer, inspector-general of police (1974–1994)"
Mohammed Ibrahim Idris,54,"Nigerian politician, member of the house of representatives (2011–2015)"
Mohan R. Wani,59,Indian biologist
Moisés Barack,80,"Peruvian football manager (Unión Huaral, Deportivo Garcilaso, national team)"
Mollie Lentaigne,103,British artist and Voluntary Aid Detachment nurse during World War II
Monty Jones,73,Sierra Leonean plant breeder
Mooryati Soedibyo,96,"Indonesian politician and royal, deputy speaker of the People's Consultative Assembly (2004–2009) and founder of Puteri Indonesia"
Morten Rieker,83,Norwegian Olympic sailor (1976)
Motsoko Pheko,93,"South African lawyer, author and historian"
Mouncif El Haddaoui,59,"Moroccan footballer (AS Salé, national team)"
Muhammed Faris,72,"Syrian aviator and cosmonaut (Soyuz TM-2, Soyuz TM-3), complications from a heart attack"
Muluken Melesse,70,Ethiopian singer and drummer
Murunwa Makwarela,51,"South African politician, mayor of Tshwane (2023)"
Muñequita Milly,23,"Peruvian folk singer, complications from surgery"
Mykhaylo Fomenko,75,"Ukrainian football player (Dynamo Kyiv, Soviet Union national team) and manager (national team), Olympic bronze medallist (1976)"
Márcia Denser,74,Brazilian writer and journalist (Nova)
Márta Peterdy-Wolf,101,Hungarian tennis player
N. Pugazhenthi,71,"Indian politician, Tamil Nadu MLA (since 2021)"
Nagalingam Ethirveerasingam,89,"Sri Lankan Olympic high jumper (1952, 1956)"
Nancie Fadeley,93,"American politician, member of the Oregon House of Representatives (1971–1981)"
Nancy Dorian,87,American linguist
Nancy E. Gwinn,78,American librarian
Nancy Neveloff Dubler,82,"American bioethicist and attorney, heart and lung disease"
Naomi Polani,96,Israeli actress (Someone to Run With)
Naomy,46,"Romanian singer, stroke"
Nathan Templeton,44,Australian television journalist (Sunrise)
Neil Rogers,70,"Australian Olympic swimmer (1972, 1976)"
Newton da Costa,94,Brazilian mathematician
Ngapare Hopa,88,New Zealand Māori academic
Nick Phipps,72,"British Olympic bobsledder (1980, 1992)"
Noel Ratcliffe,79,Australian golfer
Nora Vagi Brash,79,Papua New Guinean playwright
Norma Howard,65,American Choctaw artist
Norman Carol,95,American violinist and concertmaster (Philadelphia Orchestra)
Notker Wolf,83,"German Benedictine priest-monk, abbot primate of the Benedictine Confederation (2000–2016), heart attack"
Noé Castañón León,76,"Mexican jurist and lawyer, justice of the Supreme Court of Justice of the Nation (1985–1995)"
Noël del Bello,81,French racing driver
O. J. Simpson,76,"American Hall of Fame football player (Buffalo Bills) and actor (The Naked Gun, The Towering Inferno), Heisman Trophy winner (1968), prostate cancer"
Octavian Vintilă,85,"Romanian Olympic fencer (1964, 1972)"
Ogbonnaya Onu,72,"Nigerian politician, minister of science (2015–2022) and governor of Abia State (1992–1993)"
Olga Fikotová,91,"Czech-American discus thrower, Olympic champion (1956), breast cancer"
Olga Slivková,87,Slovak journalist and translator
Omirbek Baigeldi,84,"Kazakh politician, äkim of Jambyl Region (1992–1995), member (1995–2011) and chairman (1996–1999) of the Senate"
Orachunnoi Hor.Mahachai,73,"Thai Muay Thai fighter, light flyweight champion (1974, 1976–1978)"
Oľga Glosíková,71,"Slovak politician, MP (1991–1992)"
Pablo García Manzano,91,"Spanish judge and lawyer, magistrate of the Supreme Court (1978–1996) and Constitutional Court (1996–2004)"
Paddy Summerfield,77,British photographer
Paliath Ravi Achan,96,"Indian cricketer (Travancore-Cochin, Kerala)"
Palitha Thewarapperuma,63,"Sri Lankan politician, MP (2010–2020), electrocution"
Paola Gassman,78,Italian actress (Let's Have a Riot)
Paolo Caccia,86,"Italian psychologist and politician, deputy (1979–1994)"
Paolo Pininfarina,65,"Italian car designer, CEO of Pininfarina (since 2008)"
Park Bo-ram,30,South Korean singer
Parviz Davoodi,72,"Iranian politician, first vice president (2005–2009) and member of the Expediency Discernment Council (since 2007)"
Pat Hennen,70,"American motorcycle racer, Finnish Grand Prix, 500cc winner (1976)"
Pat Zachry,71,"American baseball player (Cincinnati Reds, New York Mets, Los Angeles Dodgers), World Series champion (1976)"
Patsy Lovell,69,"English cricketer (Surrey, national team)"
Patt Shea,93,American television writer (Archie Bunker's Place)
Patti Astor,74,"American actress (Underground U.S.A., Wild Style) and gallerist (Fun Gallery)"
Patti Starr,82,Canadian public servant (Patti Starr affair)
Paul Auster,77,"American author (The New York Trilogy, Moon Palace, The Music of Chance), lung cancer"
Paul Tirone,73,"American politician, member of the Massachusetts House of Representatives (2001–2003)"
Pauli Siitonen,86,Finnish Olympic cross-country skier (1968)
Paulino Monsalve,65,"Spanish field hockey player, Olympic silver medallist (1980)"
Pavel Balakshin,87,"Russian politician, governor of Arkhangelsk Oblast (1991–1996), senator (1993–1996), and mayor of Arkhangelsk (1996–2000)"
Pavlo Petrychenko,31,"Ukrainian soldier and public activist, killed in action"
Pedro Deleon Guerrero,80,"Northern Mariana Islands politician, member (1984–1994) and speaker (1990–1994) of the house of representatives, cancer"
Pedro Rubiano Sáenz,91,"Colombian Roman Catholic cardinal, bishop of Cúcuta (1971–1983), archbishop of Cali (1985–1994) and Bogotá (1994–2010)"
Pekka J. Korvenheimo,83,"Finnish diplomat, five-time ambassador"
Penny Simkin,85,"American physical therapist and childbirth educator, co-founder of DONA International"
Per Henriksen,72,"Norwegian footballer (Viking, national team)"
Pete Wilk,58,"American baseball coach (Vermont Lake Monsters), brain cancer"
Pete Woolley,94,Canadian football player (Hamilton Tiger-Cats)
Peter Davidson,60,"Australian footballer (West Coast Eagles, Brisbane Bears), cancer"
Peter Demetz,101,Czechoslovak-born American Germanist and author
Peter Fulde,88,German physicist and quantum chemist
Peter Förtig,90,German composer and music theorist
Peter Higgs,94,"British theoretical physicist, discoverer of the Higgs boson, Nobel Prize laureate (2013)"
Peter Ingham,83,"Australian Roman Catholic prelate, auxiliary bishop of Sydney (1993–2001) and bishop of Wollongong (2001–2017)"
Peter Schey,76,"American lawyer, complications from cancer"
Peter Smith,80,English cricketer (Oxfordshire)
Peter Sodann,87,"German actor (Tatort, Gundermann), theater director and politician"
Petro Tolochko,86,"Ukrainian historian, archaeologist and political activist, MP (1998–2006)"
Phil Delire,67,Belgian music producer
Phil Nimmons,100,Canadian jazz clarinetist
Philip Attipoe,62,Ghanaian Olympic sprinter (1984)
Philip Hefner,91,American theologian
Philippe Laudenbach,88,"French actor (Muriel, My American Uncle, Confidentially Yours)"
Philippe Sellier,92,French literary critic
Pieter Baas,80,Dutch botanist
Pino Pinelli,85,Italian painter
Pranab Kumar Barua,89,Bangladeshi literary scholar
Pranavjyoti Deka,84,Indian writer and geologist
Princess Lawes,79,"Jamaican politician, senator (1976–1980) and MP (1980–1989)"
Péter Schumann,69,"Hungarian footballer (Újpesti Dózsa, Váci Izzó, Tatabányai Bányász)"
R. E. Clements,94,British Old Testament scholar
R. F. Lucchetti,94,"Brazilian screenwriter (The Strange World of Coffin Joe, The Strange Hostel of Naked Pleasures, Hallucinations of a Deranged Mind), respiratory failure"
R. Indira Kumari,73,"Indian politician, Tamil Nadu MLA (1991–1996)"
R. M. Veerappan,97,"Indian film producer and screenwriter (Deiva Thai, Naan Aanaiyittal, Kannan En Kadhalan) and politician, Tamil Nadu MLA (1986–1996)"
Rafiu Adebayo Ibrahim,57,"Nigerian politician, senator (2015–2019) and member of the House of Representatives (2011–2015)"
Raihan Akhter Banu Roni,72,Bangladeshi MP (2001–2006)
Rainer K. Sachs,91,German-American mathematical physicist
Rajvir Singh Diler,65,"Indian politician, MP (since 2019) and Uttar Pradesh MLA (2017–2019), heart attack"
Ralph Puckett,97,"American Army officer, Medal of Honor recipient"
Raman Subba Row,92,"English cricketer (Surrey, Northamptonshire, national team)"
Ray Chan,56,"British art director (Avengers: Infinity War, Children of Men) and production designer (Dungeons & Dragons: Honor Among Thieves), stroke"
Ray Garton,61,"American novelist, lung cancer"
Red Giant,20,American Thoroughbred racehorse. (death announced on this date)
Reita,42,Japanese bassist (The Gazette)
Renate Pickardt,87,German endocrinologist
Renato De Fusco,94,Italian architectural historian
Rene Saguisag,84,"Filipino politician, senator (1987–1992)"
Renna Kellaway,92,"British pianist and music teacher, founder of the Lake District Summer Music festival"
René Jean,92,"French rugby league player (SO Avignon, US Entraigues XIII, national team)"
Rex,76,American artist and illustrator. (death announced on this date)
Reza Davood Nejad,43,"Iranian actor (The Accused Escaped, Reza, Without Her) and television presenter, complications from sepsis and liver surgery"
Richard Heyn,81,Sri Lankan cricketer (Burgher Recreation Club) and hockey player (national team)
Richard Horowitz,75,"American film composer (Three Seasons, The Sheltering Sky, Any Given Sunday)"
Richard J. Carling,87,"American politician, member of the Utah House of Representatives (1966–1973) and Senate (1973, 1975–1990)"
Rickey Parkey,67,"American boxer, IBF world cruiserweight champion (1986–1987)"
Ro Jai-bong,88,"South Korean politician, prime minister (1990–1991), blood cancer"
Robert Basmann,98,American econometrician
Robert H. Dennard,91,American electrical engineer and inventor
Robert Hessen,87,"American historian (Steel Titan, In Defense of the Corporation)"
Robert Kane,85,American philosopher
Robert Lichal,91,"Austrian politician, member of the National Council (1979–1987) and minister of defence (1987–1990)"
Robert MacNeil,93,Canadian-American Hall of Fame journalist (PBS NewsHour) and host (America at a Crossroads)
Robert Merrihew Adams,86,American philosopher
Robert Oxnam,81,"American scholar (Asia Society), complications from Alzheimer's disease"
Robert R. Holt,106,American psychologist and peace activist
Roberto Cavalli,83,Italian fashion designer and inventor
Robin Field,88,British composer
Robin George,68,"British guitarist, singer and producer"
Robin M. Hogarth,81,British-American psychologist
Rochelle Oliver,86,"American actress (Who's Afraid of Virginia Woolf?, Scent of a Woman, Law & Order) and acting coach"
Rodney Gould,81,British motorcycle road racer
Roedad Khan,100,"Pakistani civil servant and politician, secretary of industries and production (1958–1969), interior secretary (1978–1988), and minister of accountability (1990–1993)"
Roger Hugo,81,"English footballer (West Ham United, Watford). (death announced on this date)"
Roman Gabriel,83,"American Hall of Fame football player (Los Angeles Rams, Philadelphia Eagles) and actor (The Undefeated)"
Ron Cerrudo,79,American golfer
Ron Lord,94,"Australian footballer (Sydney Prague, national team)"
Ron Thompson,83,"American actor (Baretta, Cargo, American Pop)"
Rosemarie Simmen,85,"Swiss pharmacist and politician, member of the Council of States (1987–1999)"
Ross Thornton,67,"Australian footballer (Fitzroy), cancer"
Roy Boyd,85,"English actor (The Wicker Man, Crossroads, Emmerdale)"
Roy Cross,100,British artist and aviation journalist
