Name,Age,Info
Roy Davage Hudson,93,"American academic, president of Hampton Institute (1970–1976)"
Ruben Douglas,44,"American basketball player (New Mexico Lobos, Panionios, Valencia)"
Rudi Dekkers,67,Dutch businessman and criminal
Rudolf Földvári,102,"Hungarian politician and revolutionary, MP (1953–1957)"
Rudolf Mitteregger,79,"Austrian Olympic road racing cyclist (1972, 1976)"
Rui Nepomuceno,87,"Portuguese lawyer and politician, Madeira MLA"
Russell Bentley,63,American communist fighter (Vostok Battalion). (death announced on this date)
Russell Newcombe,66,"British substance use researcher, lung cancer"
Ruth Landers,85,German-born American television producer (The Huggabug Club)
Růžena Košťálová,100,Czechoslovak Olympic sprint canoeist (1948)
Sade Robinson,19,American homicide and dismemberment victim. (death announced on this date)
Sam Nolan,93,Irish trade unionist and political activist
Sam Winningham,97,American college football player (Colorado Buffaloes) and coach (Valley State)
Sami Michael,97,"Iraqi-born Israeli writer (All Men are Equal – But Some are More, A Handful of Fog, A Trumpet in the Wadi) and human rights activist"
Samuel Kummer,56,"German organist (Frauenkirche, Dresden) and academic"
Saratu Gidado,56,Nigerian actress
Satomi Oka,88,"Japanese actress (Dai-bosatsu tōge, Akō Rōshi, Bushido, Samurai Saga)"
Sergio Fernández Fernández,85,"Chilean politician, minister of the interior (1978–1982, 1987–1988), comptroller general (1977–1978) and twice senator, cancer"
Sergio Melnick,72,"Chilean politician and economist, minister of planning (1987–1989) and councilman of Las Condes (since 2021)"
Sergio de Castro,94,"Chilean economist (El Ladrillo) and politician, minister of economy (1975–1976) and finance (1976–1982)"
Serhii Konoval,31,"Ukrainian activist and soldier, Hero of Ukraine"
Shankar Rao,40,"Indian Maoist leader (Naxalite insurgency), shot"
Shantilata Barik,65,"Indian singer, cancer"
Sharon Lubinski,71,American law enforcement official
Sheila Isham,96,"American printmaker, painter and book artist, pneumonia"
Shib Narayan Das,77,"Bangladeshi designer, first craftsman of the first national flag"
Shigeharu Ueki,69,"Japanese football player (Fujita Industries, national team) and manager (Montedio Yamagata)"
Shishkin,10,"Irish-bred British Thoroughbred racehorse, winner of the Arkle Challenge Trophy (2021), Clarence House Chase (2022), and Aintree Bowl (2023)"
Siegfried Kirschen,80,German football referee
Silento Rodriguez,90,Mexican-American professional wrestler
Sir Andrew Davis,80,"English conductor (BBC Symphony Orchestra, Lyric Opera of Chicago, Melbourne Symphony Orchestra), leukaemia"
Sir Chips Keswick,84,"British merchant banker, chairman of Arsenal F.C. (2013–2020)"
Sir Colin Giltrap,84,New Zealand Hall of Fame businessman and philanthropist
Sir Ian Stoutzker,95,British banker and philanthropist
Sir Paul Fox,98,"British television producer (BBC Television), complications of a stroke"
Sir Peter Hordern,95,"British politician, MP (1964–1997)"
Sir Robert Martin,66,"New Zealand disability rights activist, member of the UN Committee on the Rights of Persons with Disabilities (since 2017)"
Sir Stephen Oliver,85,British judge
Sir Vincent O'Sullivan,86,"New Zealand writer, Poet Laureate (2013–2015)"
Spencer Milligan,86,American actor (Land of the Lost)
Srinivasa Prasad,76,"Indian politician, MP (1980–1996, 1999–2004, since 2019)"
Stefano Cherchi,23,"Italian jockey, complications from a head injury"
Stefano Stefani,85,"Italian politician, MP (1994–2013)"
Steffen Heitmann,79,"German politician, minister of justice of Saxony (1990–2000) and member of the Landtag (1994–2009), complications from Parkinson's disease"
Stephanie Sparks,50,American golfer and television personality
Stephen Grimason,67,Northern Irish journalist and editor (BBC Northern Ireland)
Steve Duggan,76,"Irish Gaelic footballer (Ballyhaise, Cavan)"
Steve Sloan,79,"American football player (Alabama Crimson Tide, Atlanta Falcons) and coach (Texas Tech Red Raiders)"
Sturgis Nikides,66,"American guitarist (Low Society, Cool It Reba), cancer"
Sudhir Kakar,85,Indian psychoanalyst and writer
Sue Chew,66,"American politician, member of the Idaho House of Representatives (since 2006), pancreatic cancer"
Sue Johnson,76,"British clinical psychologist, couples therapist and author, cancer"
Sue Stultz,71,"Canadian politician, New Brunswick MLA (2010–2014)"
Sunday Akpata,87,Nigerian Olympic long jumper (1964)
Suryatna Subrata,84,Indonesian military officer and politician
Suzanne Norwood,98,English jurist
Syed Rafat Alam,73,"Indian judge, chief justice of the Madhya Pradesh High Court (2009–2011)"
Sylvia Fein,104,American painter and author
Sylvia Gyde,88,British public health doctor and medical researcher
Sándor Müller,75,"Hungarian footballer (Vasas, Hércules, national team)"
Sérgio Ribeiro,88,"Portuguese politician, MEP (2004–2005)"
Takeshi Shirai,47,"Japanese Olympic equestrian (1996, 2000)"
Tatyana Konyukhova,92,"Russian actress (Over Tissa, Balzaminov's Marriage, Moscow Does Not Believe in Tears)"
Ted Toleman,86,"British motor racing executive, founder of Toleman, heart attack"
Ted Wilson,84,"American politician, mayor of Salt Lake City (1976–1985), complications from heart failure and Parkinson's disease"
Temoteo Brito,82,"Brazilian politician, three-time mayor of Teixeira de Freitas, member of the Legislative Assembly of Bahia (1991–1992, 2011–2015)"
Terry A. Anderson,76,"American journalist (Associated Press), Hezbollah hostage (1985–1991), complications from heart surgery"
Terry Carter,95,"American actor (Foxy Brown, McCloud, Battlestar Galactica)"
Terry Hill,52,"Australian rugby league player (Manly Warringah, New South Wales, national team), heart attack"
Terto,77,"Brazilian footballer (Santa Cruz, São Paulo, Ferroviário), heart attack"
Thawee Kraikupt,84,"Thai politician, member of the House of Representatives (1979–2000)"
Thelma Dorantes,74,Mexican actress
Thomas Farr,69,"American attorney, heart disease"
Thomas Gumbleton,94,"American Roman Catholic prelate, auxiliary bishop of Detroit (1968–2006)"
Thomas Kessler,86,Swiss electronic music composer. (death announced on this date)
Thomas Nisbett,98,Bermudian Anglican priest
Thérèse Gouin-Décarie,100,Canadian academic and psychologist
Toby Simkin,59,English theatrical producer
Tom Okurut,64,Ugandan environmental activist
Tom Tischinski,79,American baseball player (Minnesota Twins)
Toni Ann Palermo,91,"American baseball player (Chicago Colleens, Springfield Sallies)"
Tony Felloni,81,"Irish drug dealer, heart attack"
Tony Jones,53,"American professional wrestler (APW, XPW, WWE)"
Tony Morgan,92,"British sailor, Olympic silver medallist (1964)"
Tony Tuff,69,Jamaican reggae singer (The African Brothers)
Tony Whyte,84,"Irish Gaelic football player (Clann na nGael, Roscommon GAA) and manager (Roscommon GAA)"
Tribert Rujugiro Ayabatwa,83,"Rwandan businessman, founder of Pan African Tobacco Group"
Trina Robbins,85,"American comic book artist and writer (It Ain't Me, Babe, Wimmen's Comix, Wonder Woman), stroke"
Türker İnanoğlu,87,Turkish film director and television producer (Yabancı Damat)
Umm Fahad,27,"Iraqi social media personality, shot"
Uyunqimg,81,"Chinese politician, vice chair of the Standing Committee of the National People's Congress (2003–2013) and chair of Inner Mongolia (2000–2003)"
Valentyn Korenchuk,47,Ukrainian fighter pilot
Vatslav Mikhalsky,85,Russian writer
Veljko Bulajić,96,"Montenegrin film director (Train Without a Timetable, Kozara, Great Transport)"
Vera Svoboda,87,Croatian singer
Vera Tschechowa,83,"German actress (Widower with Five Daughters, Euridice BA 2037, And That on Monday Morning), director, and screenwriter"
Victor Corpus,79,Filipino military and intelligence officer
Victor Fuentealba,101,"American labor union leader, president of the American Federation of Musicians (1978–1987)"
Victor Riley,49,"American football player (Kansas City Chiefs, New Orleans Saints, Houston Texans)"
Vince Lee,85,American explorer and writer
Vincent Friell,64,"Scottish actor (Trainspotting, Restless Natives, The Angels' Share)"
Vitus Huonder,81,"Swiss Roman Catholic prelate, bishop of Chur (2007–2019)"
Vivek Dhakar,47,"Indian politician, Rajasthan MLA (2018), suicide"
Vladimir Aksyonov,89,"Russian cosmonaut (Soyuz 22, Soyuz T-2)"
Vladimir Andreyev,57,"Russian race walker, Olympic bronze medallist (2000)"
Volker Mosblech,69,"German politician, MP (2015–2017) and member of the Landtag of North Rhine-Westphalia (2004–2005)"
Vontae Davis,35,"American football player (Miami Dolphins, Indianapolis Colts, Buffalo Bills)"
Vytautė Žilinskaitė,93,Lithuanian writer
W. R. Johnson,90,American classicist
Walid Daqqa,62,"Palestinian novelist and activist, complications from cancer"
Waliul Haq Rumi,59,"Bangladeshi actor, colon cancer"
Wally Dallenbach Sr.,87,American Hall of Fame racing driver (CART)
Wally Harris,88,Canadian ice hockey referee
Walter Kolbow,80,"German politician, MP (1980–2009)"
Wan Huilin,85,Chinese physical chemist
War Chant,27,"American Thoroughbred racehorse, Breeders' Cup Mile winner (2000)"
Wendy James,84,British social anthropologist and academic
Werner Spitz,97,German-American forensic pathologist
Whitey Herzog,92,"American Hall of Fame baseball player (Washington Senators), executive (New York Mets), and manager (St. Louis Cardinals), World Series champion (1969, 1982)"
William Calley,80,American war criminal (My Lai massacre)
William F. Pepper,86,"American lawyer and conspiracy theorist, pneumonia"
William Herbert Hunt,95,American oil billionaire
William J. Byron,96,"American Jesuit priest, president of the University of Scranton (1975–1982) and Catholic University of America (1982–1992)"
Willie Limond,45,"Scottish boxer and footballer (Albion Rovers), complications from a seizure"
Wim Kozijn,83,"Dutch politician, mayor of 's-Graveland (1987–2002)"
Wolfgang Schüler,66,"German footballer (Borussia Dortmund, Stuttgarter Kickers, 1. FC Saarbrücken)"
Wong Liang Hun,70,"Singaporean Olympic fencer (1992), cancer"
Xiang Chongyang,96,Chinese agriculturalist
Yagutil Mishiev,97,Russian-Israeli historian
Yan Wenming,91,Chinese archaeologist
Yasuo Muramatsu,91,"Japanese voice actor (One Piece, Case Closed, Mobile Suit Gundam)"
Yorick Blumenfeld,91,Dutch-born British writer
Yoshio Masui,93,Japanese-Canadian cell biologist
Yukio Kasaya,80,"Japanese ski jumper, Olympic champion (1972)"
Yumi Katsura,94,Japanese fashion designer
Yuri Ponosov,83,"Tajik politician, mayor of Dushanbe (1994–1996)"
Yury Drobyshev,68,"Russian mathematician and academic administrator, rector of Kaluga State University (2004–2010)"
Yury Grekov,80,Russian army officer
Zack Norman,83,"American comedian, film producer (Tracks), and actor (Romancing the Stone, Cadillac Man), complications from COVID-19"
Zdzisław Skrzeczkowski,93,"Polish basketball player (Legia Warsaw, ŁKS Łódź, national team)"
Zhang Lixiong,110,"Chinese major general and politician, deputy (1975–1978)"
Zheng Jiagai,61,"Chinese paramilitary officer, chief of staff of the People's Armed Police Force (2017–2020)"
Zhong Binglin,72,"Chinese academic administrator and politician, president of Beijing Normal University (2001–2012)"
Ziraldo,91,"Brazilian author (O Menino Maluquinho), painter, and journalist"
Zsuzsa Ferge,92,Hungarian sociologist
Ángel Aranda,89,"Spanish actor (Planet of the Vampires, The Colossus of Rhodes, La bella di Lodi)"
Ángela Ragno,92,"Argentine actress (Night of the Pencils, Kisses on the Forehead, Empty Nest)"
Ângelo Victoriano,56,Angolan four-time Olympic Hall of Fame basketball player
Étienne Delessert,83,"Swiss illustrator, cancer"
