Name,Age,Info
Raymond Kamber,79,Swiss Olympic sprint canoer
Reha Oğuz Türkkan,90,Turkish writer
René Oreel,87,Belgian cyclist
Richard Kindleberger,67,"American newspaper reporter (The Boston Globe), brain tumor"
Robben Wright Fleming,93,American president of the University of Michigan (1968–1978)
"Robert ""Squirrel"" Lester",67,"American smooth soul tenor (The Chi-Lites), liver cancer"
Robert B. Parker,77,"American detective writer (Spenser series, Jesse Stone novels), heart attack"
Robert D. Rowley,68,American Episcopal Bishop of Northwestern Pennsylvania (1991–2007)
Robert Gerard,89,Belgian footballer
Robert Joffe,66,"American lawyer, pancreatic cancer"
Robert Lam,64,"Malaysian news presenter, skin cancer"
Robert Mosbacher,82,"American politician, Secretary of Commerce (1989–1992), pancreatic cancer"
Roger Pierre,86,"French actor (Mon oncle d'Amérique), cancer"
Rolf Thieme,65,German Olympic hockey player
Ron Giles,90,English cricketer (Nottinghamshire)
Ronald Moore,84,Canadian politician
Rory Markas,54,"American baseball radio announcer (Los Angeles Angels of Anaheim), heart attack"
Rosalie Abrams,88,"American feminist playwright, actress and activist, Alzheimer's disease"
Rowland Wolfe,95,American Olympic gold medal-winning (1932) gymnast
Ruben Kruger,39,"South African rugby union player, brain tumor"
Rupert Hamer,39,"British journalist, defence correspondent for the Sunday Mirror, improvised explosive device"
Ruth Cohn,97,German psychotherapist
Ruth P. Smith,102,American pro-choice campaigner
Sailadhar Baruah,68,"Indian film producer, complications of diabetes"
Sam Dixon,60,"American minister, Deputy General Secretary of UMCOR (since 2007), earthquake"
Sam Match,87,American tennis player
Sandro de América,64,"Argentinian singer, complications from heart and lung transplant surgery"
Sanna Kiero,79,Finnish Olympic cross-country skier
Sarah Mulvey,34,"British television producer (Channel 4), suspected suicide by opioid overdose"
Sayeed Ahmed,79,Bangladeshi playwright
Sefis Anastasakos,68,"Greek politician, author, lawyer and activist, cancer"
Serge Marcil,65,"Canadian politician, Quebec National Assembly of Quebec (1985–1994), MP for Beauharnois—Salaberry (2000–2004)"
Seymour Sarason,91,American psychologist
Shirley Bell Cole,89,American voice actor (Little Orphan Annie)
Shirley Collie Nelson,78,"American country singer, ex-wife of Willie Nelson"
Shizuka Miura,47,"Japanese ball-jointed doll maker and musician, suicide"
Simon Digby,77,"Indian-born British scholar and linguist, pancreatic cancer"
Sir Allen McClay,77,"British pharmaceutical company founder, cancer"
Sir Derek Hodgkinson,92,British air chief marshal
Sir Dermot de Trafford,85,British aristocrat and businessman
Sir Donald Acheson,83,"British physician, Chief Medical Officer of England (1983–1991)"
Sir Ian Brownlie,77,"British barrister, traffic collision"
Sir Percy Cradock,86,"British diplomat, after short illness"
Sir Robin Maxwell-Hyslop,78,"British politician, MP for Tiverton (1960–1992)"
Sir Thomas Prickett,96,British RAF Air Chief Marshal
Slavka Maneva,75,Macedonian writer and poet
Stanisław Przybylski,79,Polish modern pentathlete
Stephen Huneck,61,"American wood carving artist, suicide by gunshot"
Steve Lovelady,66,"American Pulitzer Prize-winning journalist, throat cancer"
Sumner G. Whittier,98,"American politician, Lieutenant Governor of Massachusetts (1953–1957)"
Sándor Barcs,97,"Hungarian politician and sport executive, interim President of UEFA (1972–1973)"
Sølve Grotmol,70,Norwegian sports commentator
Tadeusz Góra,91,Polish pilot
Takis Michalos,63,Greek Greece men's national water polo team water polo player and coach; cancer
Takumi Shibano,83,"Japanese novelist, pneumonia"
Tan Eng Yoon,82,Singaporean Olympic sprinter
Teddy Pendergrass,59,"American soul singer, complications from colorectal cancer"
Tetsuo Narikawa,65,"Japanese actor (Spectreman) and karate instructor, lung cancer"
Thomas Cullinan,63,South African cricketer
Thomas F. Cowan,82,"American politician, New Jersey State Senator (1984–1994)"
Thomas Summers West,82,Scottish chemist
Thorleif Karlsen,100,"Norwegian police inspector, politician and radio host, natural causes"
Tibet,78,French comics artist and writer
Tom Brookshier,78,"American football player (Philadelphia Eagles), coach and sportscaster (CBS Sports, WCAU), cancer"
Tom Cochran,85,American football player (Washington Redskins)
Tom Howard,59,"American musician, heart attack"
Tom Wittum,60,"American football player (San Francisco 49ers), cancer"
Tommy Sloan,84,"Scottish footballer (Hearts, Motherwell)"
Tomás Eloy Martínez,75,"Argentine writer and journalist, brain tumor"
Toni Tecuceanu,37,"Romanian comedy actor, bacterial infection"
Tony Clarke,68,"British musician and record producer (The Moody Blues), emphysema"
Tony Cummins,103,Irish Roman Catholic priest
Tony Halme,47,"Finnish professional boxer, actor, wrestler and Member of Parliament (2003–2007), suicide by gunshot"
Torbjørn Yggeseth,75,Norwegian ski jumping athlete and official
Tsutomu Yamaguchi,93,"Japanese survivor of Hiroshima and Nagasaki atomic bombings, stomach cancer"
Tuanaitau F. Tuia,89,"American Samoan politician and legislator, longest serving member of the American Samoa Fono"
Ulf Olsson,58,"Swedish murderer, suicide by hanging"
Ursula Mommens,101,British potter
Vadú,32,"Cape Verdean singer, traffic collision"
Vanda Skuratovich,84,Belarusian Roman Catholic activist
Vera Zakharova,89,first Yakut woman to fly a plane
Viktor Kaisiepo,61,Netherlands New Guinean-born Dutch activist for West Papuan independence
Vimcy,84,Indian sports writer
Vladimir Karpov,87,"Russian writer, Chairman of the USSR Union of Writers (1986–1991)"
Wallace Michael Ross,89,British organist and choirmaster
Walter Fondren,73,"American football player and conservationist, heart failure"
Wendall Anschutz,71,American television newsman
Wilf Paish,77,"British athletics coach, after long illness"
Wilfriede Hoffmann,77,German Olympic athlete
William Green,82,British aviation writer
William Vitarelli,99,American educator and architect
Willie Mitchell,81,"American musician and record producer, cardiac arrest"
Yabby You,63,"Jamaican reggae singer and producer, stroke"
Zahid Sheikh,60,Pakistani Olympic silver medal-winning (1972) field hockey player
Zelda Rubinstein,76,"American actress (Poltergeist, Picket Fences, Scariest Places on Earth)"
Zilda Arns,75,Brazilian pediatrician and humanitarian
Éric Rohmer,89,French film director
