Name,Age,Info
Werner von Moltke,83,"German decathlete, European champion (1966)"
Wesley Pruden,83,American journalist and editor (The Washington Times)
William E. Dannemeyer,89,"American politician, member of the U.S. House of Representatives (1979–1993) and the California State Assembly (1963–1967, 1976–1978)"
William H. Walls,86,American senior judge of the District Court for the District of New Jersey (1994–2005)
William Morton,58,"Scottish cricketer (Warwickshire Bears, national team)"
Wolfgang Joklik,92,Austrian-born American virologist
Wong Po-yan,96,"Hong Kong industrialist and politician, member of the Legislative Council (1979–1988) and chairman of the Airport Authority (1995–1999)"
Yaakov Malkin,92,Israeli writer and literary critic
Yannis Spathas,68,Greek guitarist (Socrates Drank the Conium)
Yao Lee,96,"Chinese singer (""Rose, Rose, I Love You"")"
Yasuhiro Takemoto,47,"animation director (Hyouka, Amagi Brilliant Park, Miss Kobayashi's Dragon Maid)"
Yelena Grigoryeva,41,"Russian LGBT activist, stabbed and strangled"
Yoshiji Kigami,61,"animation director (Munto, Tamako Market, Nichijou)"
Yu Dunkang,89,Chinese philosopher and historian of philosophy
Yukiya Amano,72,"Japanese diplomat, Director General of the International Atomic Energy Agency (since 2009)"
Yuriy Shlyakhov,36,"Ukrainian Olympic diver (2008), heart disease"
Yuu Shimaka,70,"Japanese voice actor (Kingdom Hearts, Ergo Proxy, Code Geass)"
Yves Forest,98,"Canadian politician, MP (1963–1972)"
Zaheen Tahira,79,"Pakistani actress (Khuda Ki Basti, Murad, Umm-e-Kulsoom), complications from a heart attack"
Zdeněk Srstka,83,"Czech Olympic weightlifter (1960), stuntman and actor (Poslední propadne peklu)"
Zenon Begier,83,"Polish Olympic athlete (1960, 1964)"
Zhai Xiangjun,80,Chinese translator and educator
Zhang Baifa,84,"Chinese politician, Vice Mayor and Executive Vice Mayor of Beijing (1983–1995)"
Zhao Meng,62,Chinese sculptor
Zhao Zhihong,46,"Chinese serial killer and rapist, executed by firing squad"
iNcontroL,33,"American professional StarCraft player, pulmonary embolism"
Ágnes Heller,90,"Hungarian philosopher and political theorist (The New School), drowned"
Élie Brousse,97,"French rugby league player (Roanne, Lyon, national team)"
Éric Névé,57,"French film producer (Dobermann, Sheitan, Suburra)"
Óscar Enrique Sánchez,64,"Guatemalan Olympic footballer (1976), (Comunicaciones, national team)"
