Name,Age,Info
A. K. Roy,90,"Indian politician, MP (1977–1984, 1989–1991)"
Aaron Rosand,92,American violinist
Abdul Hamid,92,"Pakistani field hockey player, Olympic champion (1960) and silver medallist (1956), lung injury"
Abu Bakar,66,"Indonesian politician, regent of West Bandung (2008–2018)"
Adam Bob,51,"American football player (New York Jets), liver disease"
Adel Zaky,71,"Egyptian Roman Catholic prelate, Vicar Apostolic of Alexandria (since 2009)"
Adila Mutallibova,81,"Azerbaijani socialite, First Lady (1991–1992)"
Adrian Bey,81,Rhodesian-born American tennis player
Ajoy Mukhopadhyay,90,Indian politician
Al Picard,96,"Canadian ice hockey player (Sudbury Wolves, Buffalo Bisons, Dallas Texans)"
Alan Alder,82,Australian ballet dancer
Alan Rogan,68,"British guitar technician (The Who), cancer"
Albert Shepherd,82,"British actor (The Anniversary, Charlie Bubbles, Before Winter Comes)"
Albert W. Bally,94,American geologist
Alberto Ponce,84,Spanish classical guitarist and teacher
Aleksandr Chumakov,92,"Russian Olympic sailor (1952, 1956)"
Aleksandr Shumidub,55,Belarusian Olympic ice hockey player (1998) and manager
Alex Navab,53,American financier
Alexis Galanos,78,"Cypriot politician, president of the House of Representatives (1991–1996) and Mayor-in-exile of Famagusta (since 2006)"
Alfred G. Redfield,90,American physicist and biochemist
Amelia Mustone,90,American politician
Amirali Karmali,89,"Ugandan businessman, CEO of Mukwano Group"
Amit Purohit,32,Indian actor
Andrea Camilleri,93,"Italian writer (Salvo Montalbano) and television writer (Le inchieste del commissario Maigret), complications from a heart attack"
Andrew Golden,33,"American convicted murderer, traffic collision"
Andrew Graham-Yooll,75,Argentine journalist and writer
André Bradford,48,"Portuguese politician and journalist, Azores MLA (since 2004), MEP (since 2019), cardiac arrest"
André Pinçon,88,"French politician, Mayor of Laval (1973–1994)"
Ann Moyal,93,Australian historian
Anner Bylsma,85,Dutch cellist
Antonino Cuffaro,87,"Italian politician, MP (1976–1987, 1994–1996)"
Antonio Franchi,83,Italian racing cyclist
April Byron,72,Australian singer
Archie Roboostoff,67,American Olympic footballer (1972)
Arisu Jun,66,"Japanese actress and singer, cancer"
Arman Kirakossian,62,"Armenian diplomat, Minister of Foreign Affairs (1992–1993), ambassador to the United States (1999–2005) and United Kingdom (since 2018)"
Armand Jung,68,"French politician, Deputy (1997–2016)"
Arnie Brown,77,"Canadian ice hockey player (New York Rangers, Detroit Red Wings, Toronto Maple Leafs)"
Arno Marsh,91,American jazz saxophonist
Arseny Mironov,101,Russian aeronautical engineer
Arswendo Atmowiloto,70,"Indonesian journalist and writer, prostate cancer"
Art Neville,81,"American singer-songwriter and keyboardist (The Meters, The Neville Brothers)"
Arte Johnson,90,"American comedian and actor (Rowan & Martin's Laugh-In), Emmy Award winner (1969), bladder and prostate cancer"
Arthur McGee,86,American fashion designer
Arthur Ryan,83,"Irish clothier, founder and chairman of Primark"
Arto Nilsson,71,"Finnish boxer, Olympic bronze medallist (1968)"
Artur Brauner,100,"Polish-born German film producer (The Plot to Assassinate Hitler, Angry Harvest, Europa Europa)"
Arturo Fernández Rodríguez,90,"Spanish actor (Red Cross Girls, College Boarding House, The Locket), stomach cancer"
Arvind Varma,71,Indian-born American chemical engineer
Asao Hirano,92,"Japanese medical researcher, discoverer of Hirano bodies"
Asghar Ghandchi,91,Iranian entrepreneur
Attoor Ravi Varma,88,"Indian poet and translator, pneumonia"
Augusto Fantozzi,79,"Italian lawyer and politician, Minister of Economy and Finance (1995–1996)"
Bandar bin Abdulaziz Al Saud,96,Saudi royal
Barbara Staff,94,American political activist
Barbara Zatler,38,Danish model and actress (Klown)
Barney Smith,98,"American plumber, artist and museum curator"
Barry Coe,84,"American actor (Jaws 2, Peyton Place, Bonanza), myelodysplastic syndrome"
Bartolo Pellegrino,84,"Italian politician, Sicilian Regional Deputy (1971–1976, 1991–2003), founder of the New Sicily party"
Basant Kumar Birla,98,"Indian businessman, Chairman of B.K. Birla Institute of Engineering & Technology (since 2007)"
Bassam Shakaa,89,"Palestinian politician, mayor of Nablus (1976–1982)"
Beji Caid Essebsi,92,"Tunisian politician, President (since 2014), Prime Minister (2011), and Minister of Foreign Affairs (1981–1986)"
Bella Tovey,92,Polish Holocaust survivor
Ben Johnston,93,American microtonal composer
Ben Kinchlow,82,"American author, minister and televangelist, co-host of The 700 Club"
Benjamin S. Blanchard,89,American systems engineer
Bernard Bartzen,91,American tennis player
Bernard Evans,82,"English footballer (Oxford United, Wrexham, Queens Park Rangers)"
Bert Rechichar,89,American football player (Baltimore Colts)
Bianca Devins,17,"American social media personality, stabbed"
Bill Casimaty,83,Australian farmer
Bill Huffman,94,American politician
Bill Luxton,92,Canadian actor and announcer (Tukiki and His Search for a Merry Christmas)
Bill Schulz,80,American journalist (Reader's Digest)
Bill Vitt,76,American drummer
Bill Walker,85,American football player (Edmonton Eskimos)
Bob Bastian,80,"American politician, member of the Pennsylvania House of Representatives (1999–2008), crushed by tractor"
Bob Collymore,61,"Guyanese-born British telecom executive, CEO of Safaricom (since 2010), acute myeloid leukaemia"
Bob Fouts,97,"American broadcaster (San Francisco 49ers) and sports reporter (KPIX, KGO)"
Bob Frank,75,American singer-songwriter
Bobbie Lea Bennett,72,American disability and transgender rights activist
Bobby Hopkins,62,American football player (Tampa Bay Bandits) and world champion arm-wrestler
Bobby Park,73,"English footballer (Aston Villa, Wrexham, Hartlepool United), cancer"
Bogusław Schaeffer,90,"Polish composer, musicologist and graphic artist"
Boris Bračulj,79,Croatian football player and manager
Boris Vorobyov,69,Soviet Olympic rower (1972)
Brendan Fennelly,63,Irish hurling manager and player
Brendan Grace,68,"Irish comedian and actor (Moondance, Father Ted), lung cancer"
Brian Carter,80,"English footballer (Bath City, Bristol Rovers)"
Brian Coote,89,New Zealand legal academic (University of Auckland)
Brigitte Kronauer,78,German writer
Bruce Laingen,96,"American diplomat, Ambassador to Malta (1977–1979), captive during the Iran hostage crisis, complications from Parkinson's disease"
Bruce Wallrodt,67,"Australian shot putter and javelin thrower, Paralympic champion (1988, 1992, 1996)"
Bruce Webster,91,"Australian broadcaster and politician, member of the New South Wales Legislative Assembly for Pittwater (1975–1978)"
Bryan Magee,89,"British philosopher and politician, MP (1974–1983)"
Byambasuren Sharav,66,Mongolian composer and pianist
Calvin Quate,95,American electrical engineer
Cameron Boyce,20,"American actor (Jessie, Grown Ups, Descendants), epileptic seizure"
Cao Shuangming,89,"Chinese general, Commander of the PLA Air Force (1992–1994)"
Carl Bertil Agnestig,95,Swedish music teacher and composer
Carlos Cruz-Diez,95,Venezuelan artist
Carter F. Bales,80,American investor and environmentalist
Cathy Inglese,60,"American college basketball coach (Vermont, Boston College, Rhode Island), fall"
Cesare Rizzi,79,"Italian politician, Deputy (1996–2006)"
Charan Narzary,86,"Indian politician, MP (1977–1980), complications from a fall"
Charlee Jacob,67,American author
Charles Ceccaldi-Raynaud,94,"French lawyer and politician, Senator (1995–2004), Deputy (1993–1995), Mayor of Puteaux (1969–2004)"
Charles E. Sova,91,American politician
Charles François,96,Belgian scientist
Charles Hardnett,80,American basketball player and coach
Chaser,15,American Border Collie with the largest-tested non-human memory
Chen Hu,57,"Chinese military physician and stem cell researcher, heart attack"
Chen Shunyao,101,"Chinese politician and academic administrator, deputy party secretary of Tsinghua University"
Chester Caddas,83,"American football coach (Pacific Tigers, Colorado State Rams)"
Chris Cline,60,"American billionaire mining entrepreneur, helicopter crash"
Christian Guilleminault,80,French medical researcher
Christoforos Liontakis,74,Greek poet and translator
Christopher Booker,81,"British journalist (The Sunday Telegraph, Private Eye)"
Christopher C. Kraft Jr.,95,"American aerospace engineer, Director of Johnson Space Center (1972–1982)"
Christopher Minikon,86,"Liberian public servant, statesman, ambassador, professor, historian, and businessman"
Chung Doo-un,62,"South Korean politician, Vice-Mayor of Seoul (2000–2003), MP (2004–2016), suicide"
Claes Andersson,82,"Finnish writer, psychiatrist and politician, MP (1987–1999, 2007–2008)"
Claire Dwyer,55,"British geographer, cancer"
Claro Pellosis,84,"Filipino Olympic sprinter (1960), cardiac arrest"
Claude Blanchard,74,French Olympic ice hockey player (1968)
Claude-Hélène Perrot,90,French Africanist and academic
Claudio Naranjo,86,"Chilean psychiatrist, co-developer of the Enneagram of Personality"
Clovis Swinney,73,"American football player (New Orleans Saints, New York Jets)"
Clyde Middleton,91,American politician
Costa Cordalis,75,Greek-born German schlager singer
Craig Fallon,36,"British judoka, world champion (2005), suicide"
Curt Faudon,70,Austrian film director
Cyril Edwards,71,"British medievalist and translator, heart attack"
César Pelli,92,"Argentine architect (Petronas Towers, Carnegie Hall Tower)"
Dagfinn Stenseth,82,Norwegian diplomat
Dan Clemens,74,"American politician, member of the Missouri Senate (2002–2010)"
Daniel Callahan,88,American philosopher
Daniel Rae Costello,58,"Fijian-born Samoan guitarist, cancer"
Danny Gordon Taylor,69,"American visual effects artist (Real Steel, Terminator 3: Rise of the Machines, Alita: Battle Angel), heart attack"
Danny Keogh,71,"Ugandan-born South African actor (Invictus, Zulu, The Red Sea Diving Resort)"
Danny McCarthy,76,"Welsh footballer (Cardiff City, Abergavenny Thursdays, Merthyr Tydfil). (death announced on this date)"
Darlene Tompkins,78,"American actress (Blue Hawaii), stroke"
Dave Gilbert,84,"Canadian politician, MHA (1985–1996)"
David Caplan,54,"Canadian politician, MPP (1997–2011)"
David Hedison,92,"American actor (The Fly, Live and Let Die, Voyage to the Bottom of the Sea)"
David Hunt,84,"Australian judge, member of the Supreme Court of New South Wales (1991–1998)"
David L. Ferguson,69,American academic
David Sansing,86,American historian and author
David Shanno,81,American mathematician
Deep Impact,17,"Japanese champion racehorse (Japanese Triple Crown, Japan Cup) and sire, euthanised"
Dengir Mir Mehmet Fırat,76,"Turkish politician, MP (1999–2011, since 2015), lung cancer"
Denis Pain,83,"New Zealand jurist, District Court judge (1970–1990), and Olympic eventing chef d'équipe (1988, 1992)"
Denise Nickerson,62,"American actress (Willy Wonka & the Chocolate Factory, Dark Shadows, Smile), seizure"
Derrill Osborn,76,American fashion executive (Neiman Marcus)
Detlef Thorith,76,German Olympic discus thrower
Diana Henderson,72,"British solicitor, army officer and historian"
Diane Ellingson Smith,60,American gymnast and teacher
Dianne Foster,90,"Canadian actress (Bad for Each Other, Drive a Crooked Road, The Violent Men)"
Dick Blanchfield,79,Irish hurler
Dick Hyde,83,American trombonist
Dick Lyon,79,"American Olympic rower, heart attack"
Dick de Groot,98,Dutch-American painter
Domenico Bova,72,"Italian politician, Deputy (1994–2006)"
Don Ballard,95,"American politician, member of the Georgia House of Representatives (1957–1965, 1967–1970) and Senate (1971–1982)"
Don Chelf,87,"American football player (Buffalo Bills), stroke"
Don Mossi,90,"American baseball player (Cleveland Indians, Detroit Tigers)"
Don Suggs,74,American artist
Don Wishart,85,Canadian ice hockey player
Donald W. Thompson,81,"American film director, producer and writer (A Thief in the Night)"
Donkupar Roy,64,"Indian politician, Chief Minister of Meghalaya (2008–2009), stomach disease"
Doris Goddard,89,Australian cabaret singer and actress
Dorothy Buckland-Fuller,97,Australian sociologist
Dorothy Olsen,103,American aviator
Dorothy Toy,102,American tap dancer (Toy & Wing)
Doug Flett,83,Australian songwriter
Douglas Crimp,74,"American art historian, writer and curator, multiple myeloma"
Dragomir Racić,72,"Serbian footballer (Red Star Belgrade, Castellón)"
Duane Mutch,94,"American politician, member of the North Dakota Senate (1959–1976; 1979–2006)"
Duncan Lamont,88,British jazz saxophonist and composer
Eberhard Havekost,52,German painter
Eberhard Kummer,78,Austrian singer
Eddie Bohan,86,"Irish politician, Senator (1987–2007)"
Eddie Jones,84,"American actor (Lois & Clark: The New Adventures of Superman, A League of Their Own, The Rocketeer)"
Edith Irby Jones,91,American physician
Edmund R. Thompson,89,American major general
Edna Anderson,96,"Canadian politician, MP (1988–1993)"
Eduardo Fajardo,94,"Spanish actor (The Two Faces of Fear, Nightmare City, Exterminators of the Year 3000)"
Eduardo Gómez,68,"Spanish actor and comedian (Aquí no hay quien viva, La que se avecina, Butterfly's Tongue), cancer"
Edward Lewis,99,"American film producer (Spartacus, Grand Prix, Missing)"
Edward Shotter,86,"British Anglican priest and author, Dean of Rochester (1989–2003)"
Egil Danielsen,85,"Norwegian javelin thrower, Olympic champion (1956)"
Ekaterina Koroleva,20,"Russian handballer, drowned"
Elizabeth Killick,94,"British naval electronics engineer, heart attack"
Elka Gilmore,59,"American chef, cardiac arrest"
Emanuel Hatzofe,90,Israeli sculptor
Emily Hartridge,35,"British television presenter and internet personality, traffic collision"
Ennio Guarnieri,88,"Italian cinematographer (L'assoluto naturale, The Garden of the Finzi-Continis, Brother Sun, Sister Moon)"
Enrique Lafourcade,91,"Chilean writer, critic and journalist"
Eric A. Bowie,82,Scottish-born Canadian tax judge
Ernie Broglio,83,"American baseball player (St. Louis Cardinals, Chicago Cubs), cancer"
Ernie Mims,86,American television host (WOC)
Eunice Rosen,88,American bridge player
Eva Mozes Kor,85,"Romanian-born American Holocaust survivor and author, founder of CANDLES Holocaust Museum and Education Center"
Ezzat Abou Aouf,70,"Egyptian actor, liver and heart failure"
Fanny Hopeau,74,American Olympic volleyball player
Farouk El-Fishawy,67,"Egyptian actor (The Suspect), cancer"
Feng Yuanwei,88,Chinese politician (6th CPPCC Committee Chairman of Sichuan)
Ferdinand von Bismarck,88,German landowner and lawyer
Fernando J. Corbató,93,"American computer scientist, developer of Multics, complications from diabetes"
Fernando de la Rúa,81,"Argentine lawyer and academic, President (1999–2001), heart and kidney failure"
Ferruh Bozbeyli,92,"Turkish politician, Chairman of the Democratic Party (1970–1978) and Speaker of the Grand National Assembly (1965–1970)"
Francesco Pontone,92,"Italian politician, Senator (1987–2013)"
Francisco Grau,72,"Spanish military officer and composer, Director of the Musical Unit of the Royal Guard (1988–2008)"
Frank Ackerman,72,American economist
Franz Eisl,98,"Austrian Olympic sailor (1960, 1972)"
Freddie Jones,91,"English actor (Emmerdale, The Ghosts of Motley Hall, Dune)"
Frieder Burda,83,German art collector
Futoshi Nishiya,37,"animator and character designer (Clannad, Inuyasha, Kanon)"
Gabe Khouth,46,"Canadian actor (It, Mobile Suit Gundam SEED, Once Upon a Time), cardiac arrest"
Gary Kolb,79,"American baseball player (St. Louis Cardinals, Milwaukee Braves, Pittsburgh Pirates)"
Gene Rychlak,50,"American powerlifter, heart condition"
George Barclay Richardson,94,"British economist, Warden of Keble College, Oxford (1989–1994)"
George Hilton,85,"Uruguayan actor (The Masked Man Against the Pirates, The Brute and the Beast, Man Called Invincible)"
George I. Mavrodes,92,American philosopher
George M. Browning Jr.,90,American lieutenant general
George Parshall,89,American chemist
Georgios Anastassopoulos,83,"Greek journalist (Journalists' Union of the Athens Daily Newspapers) and politician, MEP (1984–1999) and Vice President (1989–1999)"
Gerald Weissmann,88,"Austrian-born American physician, editor-in-chief of The FASEB Journal (2006–2016)"
Gerry Fairhead,96,Canadian Olympic sailor (1948)
Giancarlo Morresi,74,Italian Olympic pentathlete
Giorgio Arlorio,90,"Italian film director and screenwriter (The Shortest Day, Ogro, Once Upon a Crime)"
Giuliana Morandini,81,Italian writer and literary critic
Giuseppe Merlo,91,Italian tennis player
Glenn Mickens,88,"American baseball player (Brooklyn Dodgers), pneumonia"
Godfrey Boyle,74,British author and academic
Godfried Toussaint,75,Canadian computer scientist
Gord Simpson,91,Canadian ice hockey player (Winnipeg Maroons)
Gordon Proverbs,95,New Zealand cricketer
Graham Freudenberg,85,Australian political speechwriter
Graham Johnston,89,South African Olympic swimmer
Greg Johnson,48,"Canadian ice hockey player (Detroit Red Wings, Nashville Predators, Pittsburgh Penguins), Olympic silver medalist (1994), suicide by gunshot"
Guido Vandone,89,Italian footballer (Torino)
Gunilla Tjernberg,68,Swedish politician
Gus Stager,96,American swimming coach
H. Gopal Bhandary,66,"Indian politician, member of the Karnataka Legislative Assembly (1999–2004, 2008–2013), heart attack"
Hamza bin Laden,29,"Saudi jihadist (al-Qaeda), shot. (death announced on this date)"
Hans Lagerqvist,79,"Swedish Olympic pole vaulter (1972), brain cancer"
Harald Fereberger,90,"Austrian Olympic sailor (1952, 1960, 1972)"
Harlan Lane,82,American psychologist
Harold Dull,83,American underwater bodyworker and poet
Harold Prince,91,"American theatre director and producer (The Phantom of the Opera, Fiddler on the Roof, West Side Story)"
Harrison B. Wilson,94,"American basketball coach and educator, President of Norfolk State University (1975–1997)"
Harry Orr,74,Canadian ice hockey player
Harry Simon,95,German sinologist
Heather Nicholson,88,New Zealand geologist and author
Hilary Squires,86,South African judge and barrister
Himayat Ali Shair,93,Pakistani poet and writer
Hodan Nalayeh,42,"Somali-Canadian media executive and activist, shot"
Holger Kirschke,71,German Olympic swimmer
Houston Markham,75,American football coach
Howard Engel,88,"Canadian author, pneumonia"
Howard Nathan,47,"American basketball player (DePaul Blue Demons, Atlanta Hawks)"
Hoàng Tụy,91,Vietnamese mathematician
Hu Maozhou,91,"Chinese politician, Mayor of Chengdu (1981–1988)"
Hugh Brogan,83,British historian and biographer
Hugh Edighoffer,90,Canadian politician
Hugh McInnis,80,"American football player (St. Louis Cardinals, Detroit Lions)"
Hugh Southern,87,"British-born American performing arts manager, pneumonia and heart failure"
Hugo Cóccaro,65,"Argentine politician, Governor of Tierra del Fuego (2005–2007)"
Hugo Tolentino Dipp,88,"Dominican politician, President of the Chamber of Deputies (1982–1987)"
Humphrey Mijnals,88,"Surinamese-born Dutch footballer (Robinhood, DOS Utrecht, national team)"
Husaini Abdullahi,80,"Nigerian vice admiral, Military Governor of Bendel State (1976–1978)"
Hussain Muhammad Ershad,89,"Bangladeshi military officer and politician, Chief of Army Staff (1978–1986) and President (1983–1990), Leader of the Opposition (since 2019), MDS"
Hwang Byungsng,49,South Korean poet. (body found on this date)
Hwung Hwung-hweng,72,"Taiwanese hydraulic engineer, founder and chairman of the Ocean Affairs Council (2018–2019)"
Héctor Figueroa,57,"American labor leader, president of SEIU 32BJ, heart attack"
Ian Drohan,86,Australian football player (St Kilda Football Club)
Ian Murphy,40,American journalist and satirist (The Beast)
Ian Van Bellen,73,English rugby union and rugby league player
Ida Wyman,93,American photographer
Ike Maphotho,88,"South African revolutionary and politician, MPL (1994–2014)"
Ilaria Occhini,85,"Italian actress (Doctor and the Healer, Loose Cannons)"
Ing Wong-Ward,46,"Canadian disability rights activist and journalist, colon cancer"
Inger Berggren,85,"Swedish schlager singer (""Sol och vår"")"
Ion Geantă,59,Romanian Olympic sprint canoer
Iraj Lalezari,89,Iranian-born American academic
Ismail Changezi,65,Pakistani actor
Ivy Bethune,101,"Russian-born American actress (Back to the Future, General Hospital, Father Murphy)"
Işılay Saygın,72,Turkish politician
Jacek Baluch,79,Polish literary scholar
Jack Bond,87,English cricketer (Lancashire)
Jack O'Connell,96,"American film director and producer (Greenwich Village Story, Revolution, Swedish Fly Girls)"
Jackie Mekler,87,"South African long-distance runner, British Empire and Commonwealth silver medalist (1954)"
Jacques Rougeau Sr.,89,Canadian professional wrestler (NWF)
Jaime Lucas Ortega y Alamino,82,"Cuban Roman Catholic cardinal, Archbishop of San Cristóbal de la Habana (1981–2016), pancreatic cancer"
Jaime Posada Díaz,94,"Colombian writer and politician, Minister of National Education (1958–1962) and Governor of Cundinamarca Department (1987–1990)"
Jaime Trobo,62,"Uruguayan politician, Minister of Sports and Youth (2000–2002) and Deputy (since 1990), cancer"
Jaipal Reddy,77,"Indian politician, Minister of Earth Sciences and Science and Technology (2012–2014) and MP (1984–2014), pneumonia"
James D. Wallace,82,American philosopher
James Moeller,85,"American jurist, Justice of the Arizona Supreme Court (1987–1998)"
James Small,50,"South African rugby player (Springboks), heart attack"
James Taylor,89,Scottish cricketer
James Townsend,91,American politician
Jan Hrbatý,77,"Czech ice hockey player, Olympic silver medallist (1968)"
Jan Mokkenstorm,57,Dutch psychiatrist
"Japanese victims of the Kyoto Animation arson attack:
Naomi Ishida",49,"colorist (Hyouka, Amagi Brilliant Park, A Silent Voice).
Yoshiji Kigami, 61, animation director (Munto, Tamako Market, Nichijou).
Futoshi Nishiya, 37, animator and character designer (Clannad, Inuyasha, Kanon).
Yasuhiro Takemoto, 47, animation director (Hyouka, Amagi Brilliant Park, Miss Kobayashi's Dragon Maid)"
Jared Lorenzen,38,"American football player (Kentucky Wildcats, New York Giants, Indianapolis Colts), infection"
Jean Arasanayagam,87,Sri Lankan poet and fiction writer
Jean Brenchley,75,American microbiologist
Jean Buckley,87,"American baseball player (Kenosha Comets, Rockford Peaches)"
Jean Royer,81,Canadian poet
Jean-Luc Thérier,73,French rally driver
Jean-Pierre Worms,84,"French sociologist and politician, Deputy (1981–1993)"
Jeff Ingber,83,English table tennis player
Jeremy Kemp,84,"British actor (Top Secret!, Z-Cars, The Blue Max)"
Jerome B. Simandle,70,"American senior judge (U.S. District Court for the District of New Jersey), liver cancer"
Jerry Lawson,75,"American a cappella singer (The Persuasions), Guillain–Barré syndrome"
Jerry Seltzer,87,American roller derby promoter
Jesper Juul,71,"Danish author, pneumonia"
Jim Bouton,80,"American baseball player (New York Yankees), writer (Ball Four), and actor (The Long Goodbye), cerebral amyloid angiopathy"
Jim Shanley,82,American football player (Green Bay Packers)
Jimmy Patton,87,"British comedian (Patton Brothers, ChuckleVision), cancer"
Joan Martin,85,American baseball player (South Bend Blue Sox)
Joe Grzenda,82,"American baseball player (Detroit Tigers, Kansas City Athletics, New York Mets)"
Joe Kadenge,84,"Kenyan football player (Abaluhya) and manager (national team), complications from a stroke"
Joe Rayment,84,English footballer
Joel Filártiga,86,Paraguayan human rights activist and doctor
Joginder Singh Gharaya,92,Indian army lieutenant general
Johann Kresnik,79,"Austrian dancer, choreographer, and theater director"
Johanna Narten,88,German linguist (Narten present)
John Bailey,74,"Irish politician, member of the Dún Laoghaire–Rathdown County Council (since 2004), complications from motor neuron disease"
John Elya,90,"Lebanese-born American Melkite Greek Catholic hierarch, Bishop of Newton (1993–2004)"
John Ferriter,59,"American talent agent (William Morris Agency) and producer, complications from pancreatitis"
John Gardner,54,"Scottish legal philosopher, oesophageal cancer"
John Herd Thompson,72,Canadian historian
John Humble,63,"British hoaxer, claimed to be the Yorkshire Ripper"
John K. Davis,92,American general
John McCririck,79,"British horse racing journalist, lung cancer"
John Paul Stevens,99,"American judge, Associate Justice of the Supreme Court (1975–2010), complications from a stroke"
John Petroske,84,American Olympic silver medallist ice hockey player (1956)
John Robert Schrieffer,88,"American physicist, Nobel laureate (1972)"
John Scarlett,72,"Australian footballer (Geelong, South Melbourne)"
John Sykes,70,"American football player (San Diego Chargers), stroke"
John Tanton,85,American anti-immigration activist
John W. Harbaugh,92,American geologist
John Waddington,81,Australian footballer (North Melbourne)
John Wybrow,91,New Zealand politician and diplomat
Johnny Clegg,66,"British-born South African singer and musician (Juluka, Savuka), pancreatic cancer"
Johnny Kitagawa,87,"Japanese-American talent manager, founder and president of Johnny & Associates, stroke"
Jonathan Gathorne-Hardy,86,British author
Jonathan Hodge,78,"British composer (Henry's Cat, Fiddley Foodle Bird, Babe), multiple organ failure"
Jorge Aguado,93,"Argentine politician and ruralist, de facto Governor of Buenos Aires Province (1982–1983) and Minister of Agriculture and Livestock (1981)"
Jorma Kinnunen,77,"Finnish javelin thrower, Olympic silver medalist (1968)"
Joseph A. Falcon,96,American mechanical engineer and business executive
Joseph Amlong,82,American Olympic rower
Joseph Bolangi Egwanga Ediba Tasame,81,"Congolese Roman Catholic prelate, Bishop of Budjala (1974–2009)"
Joseph Rouleau,90,Canadian bass opera singer
José Luis Merino,92,"Spanish film director (The Hanging Woman, Scream of the Demon Lover, Réquiem para el gringo)"
