Name,Age,Info
Sebastião Tapajós,78,Brazilian guitarist and composer
Sergey Danilin,61,"Russian luger, Olympic silver medallist (1984)"
Sergio Berlinguer,87,"Italian politician and diplomat, secretary general of the Presidency (1987–1992)"
Serhiy Burimenko,51,"Ukrainian footballer (Artania, Naftokhimik Kremenchuk, Evis Mykolaiv)"
Serhiy Morozov,71,"Ukrainian football player (Zorya Luhansk, CSKA Moscow) and manager (Vorskla Poltava), COVID-19"
Sewa Singh Sekhwan,71,"Indian politician, Punjab MLA (1977–1985), liver disease"
Shakti Sinha,64,"Indian civil servant, director of the Nehru Memorial Museum & Library (2015–2019), cardiac arrest"
Shankar Rao,84,Indian actor
Shawn McLemore,54,American gospel singer
Sheldon Stone,75,American particle physicist
Sidney Walton,102,American World War II veteran
Siegfried Borchardt,67,German political activist
Sikandar Hayat Khan,87,"Pakistani politician, president (1991–1996) and prime minister (1985–1990, 2001–2006) of Azad Kashmir, heart disease"
Simon Lewty,80,English artist
Sir Archie Lamb,99,"British fighter pilot and diplomat, ambassador to Norway (1978–1980)"
Sir David Amess,69,"British politician, MP (since 1983), stabbed"
Sir Dennis Walters,92,"British politician, MP (1964–1992)"
Sir Gerry Robinson,72,"Irish-born British television presenter (Can Gerry Robinson Fix the NHS?) and executive, chair of Arts Council England (1998–2004)"
Sir Jim Lester,89,"British politician, MP (1974–1997)"
Sir John Chilcot,82,"British civil servant, kidney disease"
Sir John Morrison Forbes,96,"British Royal Navy admiral, Flag Officer, Plymouth (1977–1979)"
Sir John Rogers,93,British Royal Air Force marshal
Sir Joseph Dwyer,82,British civil engineer and businessman
Sir Michael Rutter,88,British child psychiatrist
Sir Noel Anderson,77,"New Zealand judge, president of the Court of Appeal (2004–2006) and justice of the Supreme Court (2006–2008)"
Sir Patrick Walker,89,"British civil servant, director general of MI5 (1988–1992)"
Sir Thomas Harris,76,"British banker and diplomat, ambassador to South Korea (1993–1997)"
Siran Upendra Deraniyagala,79,"Sri Lankan archaeologist, director general of archaeology (1992–2001)"
Sirkka Turkka,82,Finnish poet
Sonia Sheridan,96,American artist
Sonny Osborne,83,"American bluegrass musician (Osborne Brothers) and banjo player, stroke"
Srikanth,81,"Indian actor (Vennira Aadai, Naanal, Selva Magal)"
Stephen Brendan McMahon,66,British neuroscientist
Stephen Yang Xiangtai,98,"Chinese Roman Catholic prelate, bishop of Daming (1999–2016)"
Steve Longworth,73,English snooker player
Stewart Murray Wilson,74,New Zealand convicted sex offender
Sudi Silalahi,72,"Indonesian politician and lieutenant general, secretary of state (2009–2014)"
Sukhdev Rajbhar,70,"Indian politician, Uttar Pradesh MLA (1991–1995, 2002–2012, since 2017)"
Sunao Tsuboi,96,"Japanese hibakusha, anti-nuclear and anti-war activist"
Sune Sandbring,93,"Swedish footballer (Malmö FF, national team)"
Susagna Arasanz,60,"Andorran politician and economist, minister of finance (1994–2000) and general councillor (1997), cancer"
T.K. Abdullah,92,Indian Islamic scholar
Tajdar Babar,85,"Indian politician, Delhi MLA (1993–2008)"
Tamara Gudima,85,"Russian politician, deputy (1993–2000)"
Tasos Kourakis,73,"Greek politician, MP (2007–2019)"
Ted Venetoulis,87,"American politician, Baltimore County executive (1974–1978)"
Terry Eades,77,"Northern Irish football player (Cambridge United, Watford) and manager (Histon), cancer"
Theodore H. Geballe,101,American physicist
Thích Phổ Tuệ,104,Vietnamese Buddhist monk
Tiemen Groen,75,Dutch Olympic cyclist (1964)
Tigran Karapetyan,76,"Armenian politician, chairman of the People's Party"
Tim Johnston,80,British Olympic long distance runner (1968)
Tim Thompson,97,"American baseball player (Brooklyn Dodgers, Kansas City Athletics, Detroit Tigers)"
Timuel Black,102,American historian and civil rights activist
Todd Akin,74,"American politician, member of the Missouri (1989–2001) and U.S. House of Representatives (2001–2013), cancer"
Tom Hannegan,51,"American politician, member of the Missouri House of Representatives (since 2017), stroke"
Tom Morey,86,"American musician, engineer, and surfboard shaper"
Tom Samek,71,Czech-born Australian artist. (death announced on this date)
Tomas Norström,65,"Swedish actor (The Hunters, Good Evening, Mr. Wallenberg, The White Viking), brain tumor"
Tomoyasu Asaoka,59,"Japanese footballer (Nippon Kokan, Yomiuri, national team)"
Tony Coop,87,British golfer. (death announced on this date)
Tony DeMarco,89,"American Hall of Fame boxer, world welterweight champion (1955)"
Tony Featherstone,72,"Canadian ice hockey player (Oakland/California Golden Seals, Minnesota North Stars, Toronto Toros)"
Tony MacMahon,82,"Irish button accordion player and radio and television broadcaster, subject of Slán leis an gCeol"
Toshihiro Iijima,89,"Japanese film director (Ultra Q, Ultraman, Daigoro vs. Goliath) and screenwriter, aspiration pneumonia"
Toshirō Daigo,95,Japanese judoka
Traudl Stark,91,"Austrian child actress (A Mother's Love, The Fox of Glenarvon, Passion)"
Trevor Heath,69,"Australian footballer (Essendon, West Perth, Subiaco)"
Trevor Hemmings,86,"British football club (Cork City, Preston North End) and racehorse owner"
Tuineau Alipate,54,"Tongan-born American football player (Minnesota Vikings, Saskatchewan Roughriders, New York Jets)"
Tullis Onstott,66,"American geologist, complications from lung cancer"
Tyler Herron,35,American baseball player (Palm Beach Cardinals)
Udo Zimmermann,78,"German composer (Weiße Rose, Der Schuhu und die fliegende Prinzessin), musicologist, and opera director"
Umberto Colombo,88,"Italian footballer (Juventus, Atalanta, national team)"
Umer Shareef,61,"Pakistani comedian and television host (The Shareef Show Mubarak Ho), pneumonia"
Uri Rubin,77,Israeli Islamic scholar
Uwe Grimm,58,German mathematician and physicist
V. Govindan,80,"Indian politician, Tamil Nadu MLA (1989–1991, 1996–2001)"
V. M. M. Nair,101,"Indian diplomat and civil servant, ambassador to Norway (1960–1967), Poland (1967–1971) and Morocco (1971–1975)"
Val Bisoglio,95,"American actor (Saturday Night Fever, The Frisco Kid, Quincy, M.E.), Lewy body dementia"
Valentin Gapontsev,82,"Russian-American businessman, founder of IPG Photonics"
Valentina Malyavina,80,"Russian actress (Ivan's Childhood, A Literature Lesson, King Stag)"
Valentyna Rakytianska,73,"Ukrainian librarian, director of the Kharkiv Korolenko State Scientific Library"
Valeriano Martínez,60,"Spanish politician, minister of finance of Galicia (since 2015) and member of the Parliament of Galicia (2016–2017, 2020–2021), cardiac arrest"
Valeriu Mițul,60,"Moldovan political activist, mayor of Corjova, Dubăsari (since 1995)"
Valeriy Khmelko,82,Ukrainian sociologist
Valeriy Pidluzhny,69,"Ukrainian long jumper, Olympic bronze medallist (1980)"
Vamona Navelcar,91,Indian painter
Vano Siradeghyan,74,"Armenian politician and writer, minister of internal affairs (1992–1996) and mayor of Yerevan (1996–1998)"
Vera Kuzmina,97,Russian actress and Chuvash activist
Vera Venczel,75,"Hungarian actress (Stars of Eger, The Toth Family)"
Vibjörn Karlén,84,Swedish geographer and geologist
Vic Naismith,85,Australian footballer (Richmond)
Vic Sison,84,"Filipino footballer (Lions, national team), COVID-19"
Victor Gregg,101,British author and World War II veteran
Victor V. Zhenchenko,85,"Ukrainian poet, translator and singer"
Vigen Chitechyan,80,"Armenian politician and diplomat, deputy prime minister (1993–1995) and ambassador to European Union (1997–2009)"
Viktor Bryukhanov,85,"Uzbek engineer, director of the Chernobyl Nuclear Power Plant (1970–1986)"
Viktor Kryzhanivsky,59,"Ukrainian diplomat, ambassador extraordinary and plenipotentiary of Ukraine, fall"
Vishaka Siriwardana,65,"Sri Lankan actress, (Christhu Charithaya, Bheeshanaye Athuru Kathawak), cancer"
Vladimir Karolev,60,"Bulgarian politician and economist, member of the Municipal Council of Sofia (2003–2011)"
Vladimir Markin,64,Russian journalist and politician
Vyacheslav Khrynin,84,"Russian basketball player, Olympic silver medallist (1964)"
Vyacheslav Vedenin,80,"Russian cross-country skier, Olympic champion (1972)"
Vytautas Kolesnikovas,72,"Lithuanian painter and politician, member of the Supreme Council (1990–1992) and signatory of the Act of the Re-Establishment of the State of Lithuania"
Wakefield Poole,85,"American dancer, choreographer, and adult filmmaker (Boys in the Sand, Bijou)"
Walter Gratzer,89,German-born British biophysical chemist
Walter Reichert,92,"American politician, member of the Kentucky House of Representatives (1964–1966) and Senate (1966–1974)"
Walter Smith,73,"Scottish football player (Dundee United) and manager (Rangers, national team)"
Warren Bryant,65,"American football player (Atlanta Falcons, Los Angeles Raiders)"
Werner Lambersy,79,Belgian poet
Wes Cooley,65,"American motorcycle road racer, complications from diabetes"
Wes Magee,82,British poet and children's author
William Cook,57,American computer scientist (AppleScript)
William G. Conway,91,"American zoologist, ornithologist and conservationist"
William Izarra,74,"Venezuelan politician, military official and diplomat, senator (1998–1999) and ambassador to North Korea (since 2021), COVID-19"
William Lucking,80,"American actor (Sons of Anarchy, The Rundown, The Magnificent Seven Ride!)"
Willie Aspinall,78,"English rugby league player (Warrington, Rochdale Hornets)"
Willie Cobbs,89,"American blues singer, harmonica player and songwriter (""You Don't Love Me"")"
Willy Haeberli,96,Swiss-born American nuclear physicist
Willy Kemp,95,Luxembourgish road bicycle racer
Włodzimierz Trams,77,Polish Olympic basketball player (1968)
Xu Qin,93,"Chinese politician, delegate to the National People's Congress (1978–1998)"
Yasin Abu Bakr,80,"Trinidadian Islamic leader (Jamaat al Muslimeen) and coupist, leader of the Jamaat al Muslimeen coup attempt"
Ye Keming,84,"Chinese engineer, member of the Chinese Academy of Engineering"
Yesudasan,83,"Indian cartoonist, founder of the Kerala Cartoon Academy"
Yosef Paritzky,66,"Israeli politician, member of the Knesset (1999–2006) and minister of national infrastructures (2003–2004)"
Yossi Maiman,75,"German-born Israeli banking executive, president (2002–2013) and CEO (2006–2013) of Ampal-American Israel Corporation"
Zack Cernovsky,74,Canadian psychologist
Zafar Usmanov,84,Tajik mathematician
Zbigniew Pacelt,70,"Polish Olympic swimmer (1968, 1972) and modern pentathlete (1976)"
Zhang Hanxin,85,"Chinese physicist, member of the Chinese Academy of Sciences"
Zhang Xudong,59,"Chinese military officer, commander of the Western Theater Command (2020–2021), cancer"
Ziauddin Ahmed Bablu,66,"Bangladeshi politician, MP (2014–2019), complications from COVID-19"
Zinaida Korneva,99,Russian military veteran and charity fundraiser
Zoran Stanković,66,"Serbian military officer and politician, minister of defence (2005–2007) and health (2011–2012), COVID-19"
Álex Quiñónez,32,"Ecuadorian Olympic sprinter (2012), shot"
Étienne Mougeotte,81,"French journalist and media director, tonsil cancer"
Đuro Perić,91,"Serbian politician, MP (2008–2012, since 2020), COVID-19"
İsmet Uçma,66,"Turkish politician, MP (since 2011), lung cancer"
Žarko Potočnjak,75,"Croatian actor (Visitors from the Galaxy, The Glembays, Go, Yellow)"
