Name,Age,Info
Sherwood Schwarz,92,"American sports executive, owner of the Toronto Argonauts"
Shevah Weiss,87,"Polish-born Israeli politician, member (1981–1999) and speaker (1992–1996) of the Knesset"
Shi Zhongci,89,"Chinese mathematician, member of the Chinese Academy of Sciences"
Shirley Fulton,71,"American jurist, judge of the North Carolina Superior Court (1988–2002), gallbladder cancer"
Shoichiro Toyoda,97,"Japanese automotive executive, chairman of Toyota (1992–1999)"
Shōzō Iizuka,89,"Japanese voice actor (Mobile Suit Gundam, Fist of the North Star, Dragon Ball Z), heart failure"
Simas Kudirka,92,Lithuanian sailor (The Defection of Simas Kudirka)
Simone Edwards,49,"Jamaican-American basketball player (Seattle Storm), ovarian cancer"
Simone Segouin,97,French Resistance fighter
Sir Bernard Ingham,90,"British journalist and civil servant, Downing Street press secretary (1979–1990)"
Sir Charles Gray,94,"Scottish politician, leader of the Strathclyde Regional Council (1986–1992)"
Sir David Elliott,93,British diplomat
Sir David Lumsden,94,British musician and choirmaster
Sir William Taylor,92,"British educator and academic administrator, vice-chancellor of the University of Hull (1985–1991). (death announced on this date)"
Sixtus Josef Parzinger,91,"Austrian-Chilean Roman Catholic prelate, bishop of Villarrica (2001–2009)"
Slim Borgudd,76,Swedish racing driver and drummer (Lea Riders Group)
Solomon Perel,97,German-born Israeli author and motivational speaker (Europa Europa)
Spencer Wiggins,81,American soul singer
Srutimala Duara,57,"Indian writer, ovarian cancer"
Stanislav Štefkovič,93,Slovak decathlete
Stanley Wilson Jr.,40,American football player (Detroit Lions)
Stella Stevens,84,"American actress (Girls! Girls! Girls!, The Nutty Professor, The Poseidon Adventure), complications from Alzheimer's disease"
Steve Satterfield,85,American football coach (Wofford Terriers)
Steve Woodmore,62,"British electronics salesman, Guinness World Records record holder for most words articulated per minute (1990–1995)"
Stratis Stratigis,89,"Greek lawyer and politician, MP (1985–1989)"
Suat Türker,46,"Turkish-German footballer (Kickers Offenbach, TSF Ditzingen, İstanbulspor), heart attack"
Subi Suresh,41,"Indian actress (Happy Husbands, Drama, Panchavarnathatha) and television anchor, liver disease"
Subimal Mishra,79,Indian novelist
Sun Manji,91,Chinese biochemical pharmacologist
Susan Duhan Felix,85,American ceramic artist
Suzanne Sens,92,French author and teacher
Syd Fischer,95,Australian property developer and sailor
Séamus Ryan,85,Irish hurler
Sıtkı Güvenç,61,"Turkish politician, MP (2011–2015), complications from injuries sustained in an earthquake"
T. P. Gajendran,68,"Indian film director (Budget Padmanabhan, Middle Class Madhavan, Banda Paramasivam) and actor"
Takahiro Yokomichi,82,"Japanese politician, twice member and speaker (2009–2012) of the House of Representatives, governor of Hokkaido (1983–1995), cancer"
Takako Sasuga,87,"Japanese voice actress (Sazae-san, Danganronpa)"
Tamás Holovits,83,Hungarian Olympic sailor (1980)
Taner Savut,48,"Turkish footballer (Fenerbahçe, Siirtspor) and sporting director (Hatayspor)"
Taraka Ratna,39,"Indian actor (Okato Number Kurraadu, Yuva Rathna, Taarak), cardiac arrest"
Tasuku Tsukada,86,"Japanese politician, mayor of Nagano (1985–2001)"
Tatiana Lobo,83,Chilean-born Costa Rican writer
Ted Knap,102,American journalist
Ted Lerner,97,"American real estate developer, owner of the Washington Nationals (since 2006) and founder of Lerner Enterprises, pneumonia"
Terence Dickinson,79,"Canadian astrophotographer and amateur astronomer, complications from Parkinson's disease"
Terry Holland,80,"American basketball coach (Davidson Wildcats, Virginia Cavaliers), complications from Alzheimer's disease"
Terry Rodgers,80,Australian footballer (Essendon)
Terry Saldaña,64,"Filipino basketball player (Barangay Ginebra San Miguel, Pop Cola Panthers, Shell Turbo Chargers), kidney disease"
Teuku Sama Indra,58,"Indonesian politician, regent of South Aceh (2013–2018)"
Theo Dunne,85,Irish football player (Shelbourne) and manager (UCD)
Thibaut de Reimpré,73,French painter
Thierry Alla,67,French musicologist and composer
Thomas H. Lee,78,"American financier, founder of Thomas H. Lee Partners and Lee Equity Partners, suicide by gunshot"
Thomas R. Donahue,94,"American labor leader, president of the AFL–CIO (1995), complications from a fall"
Tim Aymar,59,American heavy metal singer (Pharaoh)
Tim Lobinger,50,"German Olympic pole vaulter (1996, 2000, 2004), leukaemia"
Tim McCarver,81,"American baseball player (St. Louis Cardinals, Philadelphia Phillies) and broadcaster (Fox Sports), heart failure"
Tim Quy,61,British musician (Cardiacs)
Tito Fernández,80,Chilean singer-songwriter
Tom Luddy,79,"American film producer (Barfly, The Secret Garden), co-founder of the Telluride Film Festival"
Tom McLeish,60,British theoretical physicist
Tom Tierney,46,Irish rugby union player (national team) and coach
Tom Whitlock,68,"American songwriter (""Danger Zone"", ""Take My Breath Away"", ""Winner Takes It All""), Oscar winner (1987), complications from Alzheimer's disease"
Toni Harper,85,American singer
Tony Earl,86,"American politician, governor of Wisconsin (1983–1987) and member of the Wisconsin State Assembly (1969–1975), stroke"
Tony Marshall,85,German Schlager and opera singer
Tony O'Donoghue,86,Irish sports commentator
Tony Scherman,72,"Canadian painter, cancer"
Tonya Knight,56,"American professional bodybuilder and game show contestant (American Gladiators), cancer"
Torbjörn Axelman,90,"Swedish television producer, director, and writer"
Trevor Boys,65,Canadian racecar driver (NASCAR)
Tulsidas Balaram,86,"Indian footballer (Hyderabad City Police, East Bengal, national team), multiple organ failure"
Tunku Abdul Aziz,89,"Malaysian politician, senator (2009–2012)"
Tunnet Taimla,34,"Estonian renju player, world champion (2003, 2013)"
Tôn Đức Lượng,98,Vietnamese painter
Vaco Baissac,82,Mauritian artist
Vadim Abdrashitov,78,"Russian film director (Fox Hunting, The Train Has Stopped, Planet Parade), cancer"
Valeria Ogășanu,76,"Romanian actress (Michael the Brave, The Yellow Rose)"
Vani Jairam,77,"Indian playback singer (Sankarabharanam, Guddi, Sollathaan Ninaikkiren), fall"
Vic Anciaux,91,"Belgian doctor and politician, MP (1965–1995)"
Victor Babiuc,84,"Romanian jurist and politician, MP (1990, 1992–2004) and minister of national defence (1996–2000)"
Victor Brox,81,English blues musician
Vijay Kichlu,92,"Indian classical singer, heart attack"
Viktor Aristov,84,"Ukrainian football player (Metalist Kharkiv, SKA Odesa, Energiya Volzhsky) and coach"
Violet Stanger,82,"Canadian politician, Saskatchewan MLA (1991–1999)"
Vito Schlickmann,94,"Brazilian Roman Catholic prelate, auxiliary bishop of Florianópolis (1995–2004)"
Vladimir Ivanovich Morozov,82,"Turkmen sprint canoeist, Olympic champion (1964, 1968, 1972)"
Vladimir Skulachev,87,"Russian biochemist, member of the Russian Academy of Sciences"
Volkan Kahraman,43,"Austrian football player (Excelsior, SV Pasching, national team) and manager, shot"
Volkmar Sigusch,82,"German sexologist, physician and sociologist"
Víctor Gómez Bergés,82,"Dominican lawyer, jurist and diplomat, minister of foreign affairs (1972–1975) and judge of the Constitutional Court (2011–2018)"
W. Carl Burger,97,German-born American painter
W. Russell Todd,94,American army major general
Walter Ferguson,103,Panamanian-born Costa Rican calypso singer-songwriter
Walter Liese,97,German forestry and wood researcher and wood biologist
Walter Mirisch,101,"American film producer (In the Heat of the Night, Midway, The Hawaiians), Oscar winner (1967)"
Wayne Burtt,78,"New Zealand cricketer (Canterbury, Central Districts)"
Wendell Fleming,94,American mathematician
Wesley Stacey,81,"Australian photographer, co-founder of the Australian Centre for Photography"
William Joseph Kurtz,87,"Polish Roman Catholic prelate, bishop of Kundiawa (1982–1999), coadjutor archbishop (1999–2001) and archbishop (2001–2010) of Madang"
William Leckie,94,British Olympic rower (1948)
Wim Kras,79,Dutch footballer (Volendam)
Wolfgang Dudda,65,"German politician, member of the Landtag of Schleswig-Holstein (2012–2017)"
Wolfgang Schallenberg,92,"Austrian diplomat, ambassador to India (1974–1978), Spain (1979–1981), and France (1988–1992)"
Wolfgang Weber,83,"German engineer and politician, member of the Landtag of Saxony (1990–1994)"
Wu Zhongru,83,"Chinese hydraulic engineer, member of the Chinese Academy of Engineering"
Xiang Xuan,96,"Chinese soldier, youngest soldier to take part in the Long March"
Xu Binshi,91,"Chinese engineer, member of the Chinese Academy of Engineering"
Yakup Taş,63,"Turkish politician, MP (since 2018)"
Yoshihisa Okumura,96,Japanese engineer
Yousef Al-Salem,37,"Saudi Arabian footballer (Al Qadsiah, Ettifaq, national team)"
Yukio Takano,85,"Japanese politician, mayor of Toshima (since 1999) and member of the Tokyo Metropolitan Assembly (1989–1999), COVID-19"
Yuth Angkinandana,86,"Thai politician, MP (1983–2001)"
Yvette Monginou,95,"French Olympic athlete (1948, 1952)"
Yvonne Constant,92,"French actress (Gigot, Monkeys, Go Home!, Their Last Night), singer and ballerina"
Zaenal Ma'arif,67,"Indonesian politician, MP (2004–2007)"
Zandra Flemister,71,American Secret Service agent and diplomat
Zhai Zhonghe,92,"Chinese biologist, member of the Chinese Academy of Sciences"
Zia Mohyeddin,91,"British-Pakistani actor (Lawrence of Arabia, Khartoum, Ashanti) and television broadcaster"
Zilan Tigris,50,Turkish-Armenian singer
Ziya Şengül,78,"Turkish footballer (Fenerbahçe, national team), organ failure"
Ángela Gurría,93,Mexican sculptor
Óscar López Balestra,88,"Uruguayan politician, deputy (1972–1973, 1985–1990)"
Şener Eruygur,81,"Turkish military officer, general commander of the gendarmerie (2002–2004)"
