Name,Age,Info
Abdelhamid Mehri,85,Algerian resistance fighter and politician
Abdollah Mojtabavi,87,Iranian wrestler
Abid Ali Nazish,40,"Afghan actor, shot"
Aengus Fanning,69,"Irish journalist, editor of the Sunday Independent, cancer"
Al Rio,49,"Brazilian comic book artist, suicide by hanging"
Alan Rowlands,82,English pianist
Albert Baskakov,83,Russian physicist
Aldo Zenhäusern,60,Swiss Olympic ice hockey player (1976)
Alejandro Rodriguez,93,American psychiatrist and academic
Alessandro Liberati,57,"Italian medical researcher, cancer"
Alex DeCroce,75,"American politician, New Jersey General Assembly Minority Leader (since 2004)"
Alex Eadie,91,"British politician, MP for Midlothian (1966–1992)"
Alexander Sizonenko,52,"Russian basketball player, world's tallest person (1991)"
Alexander Zhitinsky,71,Russian writer
Alexis Weissenberg,82,Bulgarian-born French pianist
Alfonso de Bourbon,79,"American claimant of Spanish royalty, traffic accident"
Alfred Gescheidt,85,"American photographer, cancer"
Alfred Pyka,77,German footballer
Alfredo Avelín,84,"Argentine politician, Governor of San Juan (1999–2002), multiple organ failure"
Alfredo Battisti,86,"Italian Roman Catholic prelate, Archbishop of Udine (1972–2000)"
Alicia Baro,93,American human rights activist
Althea Wynne,75,British sculptor
Alvin Devane,88,American soldier
Ambjørg Sælthun,89,Norwegian politician
Amit Saigal,46,"Indian rock magazine publisher, concert promoter and musician, drowned"
Amol Bose,69,"Bangladeshi actor, heart attack"
Anatoly Kolesov,73,"Russian wrestler, Olympic gold medalist (1964)"
Anders Frandsen,51,Danish singer and television presenter
Andrea Bosic,92,Italian actor
Andrew MacNaughtan,47,Canadian photographer
Andrew McMillan,54,Australian writer and music journalist
Andrzej Krzysztof Wróblewski,76,Polish journalist
André Green,84,French psychoanalyst
Andy Musser,74,"American sportscaster (Philadelphia Phillies, Philadelphia 76ers)"
Angela von den Driesch,77,German archaeologist and veterinarian
Anthony Bevilacqua,88,"American Roman Catholic prelate, Archbishop of Philadelphia (1988–2003)"
Anthony Capo,52,"American mobster-turned-informant (DeCavalcante crime family), heart attack"
Anthony Gonsalves,84,Indian film music composer
Anthony J. Calio,82,"American physicist and businessman, congestive heart failure and lung cancer"
Anton Blom,87,Norwegian journalist
Antonio Mistrorigo,99,"Italian Roman Catholic prelate, Bishop of Treviso (1958–1988)"
Antonio Segura,64,Spanish comics writer
Antony Barrington Brown,84,"British designer, photographer and explorer"
Arfa Karim,16,"Pakistani student, world's youngest Microsoft Certified Professional (2004–2008), idiopathic epilepsy seizures"
Arild Haaland,92,Norwegian philosopher
Armand Mercier,78,"American politician, Mayor of Lowell, Massachusetts (2004–2006)"
Arne Christiansen,85,Norwegian judge
Artax,17,"American Champion Thoroughbred racehorse, winner of the 1999 Breeders' Cup Sprint, Carter Handicap and Vosburgh Stakes"
Artie Levine,86,American boxer
Augusto Gansser-Biaggi,101,Swiss geologist
Ayelet Galena,2,"American child, born with dyskeratosis congenita, lung complications"
Azeem Daultana,32,"Pakistani politician, Member of the National Assembly, road accident"
Azer Bülbül,44,"Turkish singer and actor, heart attack"
Basil Gordon,80,American mathematician
Basil Payne,88,Irish poet
Beatriz Bandeira,102,"Brazilian communist, human rights activist, poet and writer"
Ben Hana,54,New Zealand vagrant
Bernhard Schrader,80,German theoretical chemist
Bert Daikeler,83,"American politician, member of the Pennsylvania House of Representatives"
Beverly McDermott,85,"American casting director (Cocoon, Scarface, Lenny)"
Bilal al-Berjawi,27,"Lebanese terrorist, drone strike"
Bill Dickie,82,Scottish football administrator
Bill Janklow,72,"American politician, Attorney General (1975–1979) and Governor of South Dakota (1979–1987, 1995–2003); U.S. Representative (2003–2004), brain cancer"
Bill Mardo,88,"American sportswriter, Parkinson's disease"
Bill Robb,84,"Australian politician, member of the New South Wales Legislative Assembly for Miranda (1978–1984)"
Bill Wallace,64,American author
Billie Love,88,British actress and photographer
Billy 'Silver Dollar' Baxter,85,American film producer
Bingham Ray,57,"American independent film executive, complications from strokes"
Bjørn G. Andersen,87,Norwegian geologist
Bob Anderson,89,"British Olympic fencer (1952) and fight choreographer  (Star Wars, The Lord of the Rings, The Princess Bride)"
Bob Armstrong,50,American ice hockey player
Bob Citron,79,"American entrepreneur and aerospace engineer, prostate cancer"
Bob Holness,83,South African-born British quiz show host and actor (Blockbusters)
Bob LaPointe,66,American high school and college football coach
Bob McKenzie,83,Australian football player
Bob Thalman,89,American football player and coach
Bob Weston,64,"British guitarist and songwriter (Fleetwood Mac), gastrointestinal hemorrhage. (body found on this date)"
Bob Wright,76,"American biographer and politician, Chairman of the Utah Republican Party (1977–1979), Alzheimer's disease"
Bogusława Pietkiewicz,67,Polish Olympic diver
Bohumil Golián,81,"Slovak volleyball player, Olympic silver (1964) and bronze (1968) medalist"
Borys Fedorenko,65,Ukrainian painter
Brian C. Downey,61,Canadian politician
Brian Curvis,74,"Welsh former Commonwealth welterweight champion boxer, leukaemia"
Bridie Gallagher,87,Irish singer
Bruce Riutta,67,"American Olympic ice hockey player, complications from heart surgery"
Bryan Hickman,30,"American football player (Cleveland Browns), suicide"
Bud Byerly,92,"American baseball player (St. Louis Cardinals, Cincinnati Reds)"
Camilla Williams,92,"American opera singer, complications from cancer"
Carleton B. Swift Jr.,92,American intelligence officer
Carlo Fruttero,85,Italian writer
Carlos Escarrá,57,"Venezuelan politician, Attorney General (since 2011), heart attack"
Carlos Figueroa,80,Spanish Olympic equestrian
Carlos Guirao,57,Spanish musician
Carlos Soria,63,"Argentine politician, Secretary of Intelligence (2002), Governor of Río Negro (since 2011), shot"
Carmen Naranjo,83,"Costa Rican novelist, poet and essayist, cancer"
Carol Creiniceanu,72,Romanian football player
Carolina Isakson Proctor,81,Colombian First Lady (1986–1990)
Chand Mal Lodha,93,Indian judge
Charles E. Bishop,90,American academic
Charles Fecher,94,American author
Charles H. Price II,80,American businessman and diplomat
Charles Howard,87,"Australian Roman Catholic leader, Superior General of the Marist Brothers (1985–1993)"
Charles Morris,85,"British politician, MP for Manchester Openshaw (1963–1983)"
Charles Stanmore,87,Australian Olympic fencer
Charles W. Bailey II,81,"American journalist and novelist (Seven Days in May), Parkinson's disease"
Charlie Pawsey,88,English rugby league player
Chea Soth,83,Cambodian politician
Chen Chuanxi,95,Chinese conductor
Chris Pavlou,72,Australian football player
Christian-Joseph Guyonvarc'h,85,"French philologist, specializing in Celtic studies"
Christoffer Selbekk,72,Norwegian businessman and ski jumper
Chuck Metcalf,81,American double-bassist
Claes Egnell,95,Swedish sport shooter and Olympic silver medal-winning (1952) pentathlete
Clara Nomee,73,"American politician, first female Chairperson of the Crow Nation (1990–2000)"
Clare Fischer,83,American composer
Clarence C. Pope,81,"American prelate, Episcopal Bishop of Fort Worth (1986–1994)"
Clarence Tillenius,98,Canadian artist and conservationist
Cliff Chambers,90,American baseball player
Cliff Portwood,74,"English footballer and singer, lung disease"
Clive Shell,64,Welsh international rugby player
Colin Campbell,80,"Canadian Roman Catholic prelate, Bishop of Antigonish (1986–2002)"
Colin Tarrant,59,"British actor (The Bill), suicide by exsanguination"
Colm Tucker,59,Irish rugby union player
Colonel Stone Johnson,93,American civil rights activist
Curt Meyer-Clason,101,German writer and translator
Dame Lesley Strathie,56,"British civil servant, Permanent Secretary to HM Revenue and Customs (2008–2011), cancer"
Damien Bona,56,"American journalist, writer and film historian, heart attack"
Dan Evins,76,"American entrepreneur, founder of Cracker Barrel Old Country Store"
Daniel Alba,71,Mexican Olympic wrestler
Dave Alexander,73,"American blues singer and pianist, suicide by gunshot"
Dave Lee,64,"British comedian, cancer"
David Atkinson,71,"British politician, MP for Bournemouth East (1977–2005), bowel cancer"
David Phiri,74,"Zambian businessman, Governor of the Bank of Zambia"
David W. Barron,76,British computer scientist
David Wheeler,86,American theatrical director
David Whitaker,80,English composer and songwriter
Deepika Joshi-Shah,35,Indian singer and voice actress
Diana Bliss,57,"Australian public relations consultant and theatre producer, wife of Alan Bond"
Dick Tufeld,85,"American voice actor and announcer, voice of Robot B-9 on Lost in Space"
Diego Cuenca,84,Spanish footballer.[citation needed]
Dilys Elwyn-Edwards,93,Welsh composer
Dimitra Arliss,79,"American actress (The Sting, General Hospital, Xanadu), complications from a stroke"
Dmitry Machinsky,74,Russian archaeologist
Doeschka Meijsing,64,Dutch novelist
Dolores Guinness,75,German baroness and socialite
Don Blenkarn,81,"Canadian politician, MP for Mississauga (1972–1974) and Mississauga South (1979–1993)"
Don Carter,85,"American professional bowler, complication from pneumonia and emphysema"
Don Fullmer,72,"American boxer, lymphoid leukemia"
Don Starkell,79,Canadian adventurist and author
Dorothea Tanning,101,"American surrealist painter, printmaker and sculptor"
Dudley Thompson,95,Jamaican politician and diplomat
Earle R. Gister,77,American acting teacher
Ed Derwinski,85,"American politician, U.S. Representative from Illinois (1959–1983); United States Secretary of Veterans Affairs (1989–1992), merkel cell carcinoma"
Ed Jenkins,78,"American politician, Representative from Georgia (1977–1993)"
Edarem,79,American television presenter and internet celebrity
Edgar Kaiser Jr.,69,"Canadian businessman and philanthropist, owner of the Denver Broncos (1981–1984)"
Edna Bourque,96,Canadian volunteer
Edna Sheen,67,"American makeup artist (Philadelphia, Courage Under Fire, Akeelah and the Bee)"
Eduard Ivanov,73,"Soviet ice hockey player, World and Olympic champion"
Efron Etkin,59,"Israeli actor and voice actor, cancer"
Eiko Ishioka,72,"Japanese costume designer (Bram Stoker's Dracula, Immortals, The Cell), Oscar winner (1993), pancreatic cancer"
Eisuke Hinode,70,"Japanese politician, member of the House of Councillors, gall bladder cancer"
Ekuikui IV,98,"Angolan king of Bailundo, disease"
Eladio Acosta Arteaga,95,"Colombian Roman Catholic prelate, Archbishop of Santa Fe de Antioquia (1988–1992)"
Elena Catena,91,Spanish academic and feminist
Eleutherios Katsaitis,82,"Greek-born British Orthodox hierarch, Auxiliary Bishop of Archdiocese of Great Britain (1987–1994), smothered"
Elizabeth Brumfiel,66,American archaeologist
Ellen Currie,81,American writer and advertising executive
Ellen Pence,63,"American sociologist and social activist, creator of the Duluth Domestic Abuse Intervention Project, breast cancer"
Emil Hossu,70,"Romanian actor, cardiac arrest"
Emmanuel Cooper,73,British potter and writer
Enenche Akogwu,31,"Nigerian journalist and cameraman, shot"
Erik Haaest,76,Danish journalist and author
Ernie Carson,74,American jazz musician
Ernie Gregory,90,English footballer
Errol Scorcher,55,"Jamaican reggae disc jockey, ruptured blood vessel"
Etta James,73,"American blues singer (""At Last""), leukemia"
Eve Arnold,99,American photographer
Everardus Antonius M. Baaij,90,"Dutch-born South African Roman Catholic prelate, Bishop of Aliwal (1973–1981)"
F. Elwood Davis,96,American lawyer
Fatima al-Aqel,54,Yemeni human rights activist
Felicia Eze,37,Nigerian Olympic footballer
Felipe Fernández,78,Argentine basketball player
Fernanza Burgess,51,American football player
Finn Pedersen,86,Danish Olympic gold medal-winning (1948) rower
Floro Garrido,59,"Spanish soccer player and manager, multiple organ failure"
Fong Fei-fei,60,"Taiwanese singer and actress, lung cancer"
Francella Mary Griggs,91,"American nun, advocated for federal recognition of the Confederated Tribes of Siletz Indians"
Francis Golffing,101,"Austrian-American poet, essayist, teacher, and translator"
Franco Pacini,72,Italian astronomer
Frank Ackerman Hill,92,"American U.S. Air Force officer, commander of the 33rd Air Division"
Frank Aschenbrenner,86,"German-born American football player (Chicago Hornets, Montreal Alouettes)"
Frank Cioffi,83,American philosopher
Frank Cook,76,"British politician, MP for Stockton North (1983–2010), lung cancer"
Frank Horwill,84,British athletics coach
Frank James McGarr,90,American former senior (and chief) judge of the District Court for the Northern District of Illinois
Franz Berger,71,Austrian Olympic wrestler
Franz Dorfer,61,Austrian Olympic boxer (1976)
François Migault,67,French racing driver
François-Marie Algoud,91,French royalist and author
Françoise Christophe,88,French actress
Fred Bateman,74,American economic historian
Fred Milano,72,"American doo-wop singer (The Belmonts, Dion and the Belmonts), lung cancer"
Frederica Sagor Maas,111,"American silent film screenwriter (The Plastic Age), playwright, memoirist and author"
Frederick Treves,86,British actor (The Elephant Man)
Gabriel Cadis,60,"Israeli attorney, chairman of the Jaffa Orthodox Church Association, stabbed"
Gabriel Lawrence Sengol,83,"Indian Roman Catholic prelate, Bishop of Tiruchirapalli (1990–1997)"
Gary Ablett,46,"English footballer (Liverpool, Everton, Birmingham City), non-Hodgkin lymphoma"
Gatewood Galbraith,64,"American lawyer and author, complications from chronic emphysema"
Gelareh Bagherzadeh,30,"Iranian student, shot"
Gene Bartow,81,"American college basketball coach (UAB, UCLA), stomach cancer"
Gene Methvin,77,American journalist and magazine editor
Georg Lassen,96,"German naval officer, World War II U-boat commander"
George Dargo,76,"American legal scholar, skin cancer"
George Gabin,80,American artist and art educator
George Lambert,83,American Olympic silver (1956) and bronze (1960) medal-winning modern pentathlete
George Livingston,78,"American politician, first elected black mayor of Richmond, California (1985–1993), diabetes"
Gerhard Schröder,90,German television executive
Gerre Hancock,77,American organist
Gert Puzicha,67,German boxer
Gevork Vartanian,87,"Soviet intelligence agent, Hero of the Soviet Union"
Giampiero Moretti,71,"Italian racing driver, winner of the 24 Hours of Daytona (1998), founder of Momo"
Giancarlo Bigazzi,71,"Italian composer (""Gloria"", ""Self Control"", ""No Me Ames"")"
Gilbert Temmerman,83,"Belgian politician, MP (1971–1989), Mayor of Ghent (1989–1994), Minister of State"
Gilles Jacquier,43,"French journalist, 2003 recipient of the Albert Londres Prize, grenade attack"
Giovanni De Andrea,83,"Italian Roman Catholic prelate, vice-president of Labour Office of the Apostolic See (1989–2007)"
Giuseppe Vedovato,99,Italian politician
Glenda Dickerson,66,American theatre director
Glenn Cox,80,American baseball player (Kansas City Athletics)
Goody Petronelli,88,American boxing trainer and manager (Marvin Hagler)
Gordon Buttrey,85,Canadian ice hockey player (Chicago Blackhawks)
Gordon Hirabayashi,93,American civil rights activist (Hirabayashi v. United States)
Gordon W. Bowie,67,American musician
Graham Rathbone,69,"Welsh footballer, dementia"
Greg Cook,65,"American football player (Cincinnati Bengals), complications from pneumonia"
Guido Dessauer,96,German paper engineer and art collector
Gunnar Dyrberg,90,"Danish resistance fighter, head of Holger Danske (1943–1945)"
Gustav Leonhardt,83,Dutch harpsichordist and conductor
Gyula Tarr,80,Hungarian Olympic wrestler
H. Edwin Young,94,"American economist, Chancellor of the University of Wisconsin–Madison (1968–1977)"
H. John Caulfield,75,American optical physicist
Hannes Råstam,56,Swedish journalist
Hans Schepers,81,German Olympic water polo player
Hans Wahli,84,Swiss Olympic athlete
Harlin Butterley,84,Australian Anglican priest and Dean of Hobart from 1972 to 1980
Harold Zirin,82,American astronomer
Harry Fearnley,88,English footballer
Harry Fowler,85,British character actor
Hellen Huisman,74,Dutch voice actress
Helmi Höhle,87,German Olympic fencer
Helmut Müller-Brühl,78,German conductor
Henri Puppo,98,French cyclist
Henrique da Silva Horta,91,Portuguese vice admiral and colonial administrator
Herb Clarke,84,"American television weatherman (WCAU-TV), NATAS Governor's Award winner (2007), Alzheimer's disease"
Herbert Wilf,80,American mathematician
Hermann Guggiari,87,Paraguayan engineer and sculptor
Hermano Pablo,90,American evangelist and broadcaster
Hideaki Nitani,81,"Japanese actor (Tokyo Drifter), pneumonia"
Hikaru Hayashi,80,Japanese composer
Hikmat Mizban Ibrahim,80,"Iraqi politician, Minister of Finance (1995–2003)"
Hilda Feste,98,"Norwegian woman, murdered"
Hilmar Duerbeck,63,German astronomer
Hisako Ōishi,75,"Japanese politician, member of the House of Councillors, respiratory failure.[citation needed]"
Homai Vyarawalla,98,"Indian photojournalist, first Indian woman to work as a photojournalist"
Howard H. Bell,98,American historian
Howie Koplitz,73,"American baseball player (Detroit Tigers, Washington Senators)"
Hulett C. Smith,93,"American politician, Governor of West Virginia (1965–1969)"
Ian Abercrombie,77,"British actor (Seinfeld, Army of Darkness, Star Wars: The Clone Wars), kidney failure"
Ian Bargh,76,"British-born Canadian jazz pianist, lung cancer"
Ib Spang Olsen,90,"Danish cartoonist and author, recipient of the Hans Christian Andersen Award"
Ibrahim Aslan,77,"Egyptian novelist and short story writer, heart failure"
Idichapuli Selvaraj,73,Indian actor
Idwal Fisher,76,Welsh rugby player
Iggy Arroyo,60,"Filipino politician, Representative from the 5th District of Negros Occidental (since 2004), cardiac arrest"
Ingeborg Finke-Siegmund,92,German pianist and piano teacher
Ioan Drăgan,46,"Romanian footballer (FC Brașov), colorectal cancer"
Ioannis Kefalogiannis,79,"Greek politician, MP (1958–1964; 1974–2004) and Minister of the Interior (1992–1993)"
Irena Jarocka,65,Polish singer
Isaac Díaz Pardo,91,Spanish artist
Isi Metzstein,83,German-born British architect
Israel Getzler,91,Jewish-British historian
István Rózsavölgyi,82,"Hungarian runner, Olympic bronze medalist (1960), heart problems"
Ivan Calin,76,"Moldovan politician, Acting President of the Moldovan Parliament (2009)"
Ivor Rees,85,"Welsh Anglican prelate, Bishop of St David's (1991–1995)"
J. Joseph Garrahy,81,"American politician, Governor of Rhode Island (1977–1985)"
J. O. Urmson,96,British philosopher
J. R. Boone,86,American football player (Chicago Bears)
Jack Heron,85,American college basketball coach (Sacramento State University)
Jack Roberts,58,"American climber, fall"
Jacqueline Grennan Wexler,85,American Roman Catholic nun and university president
Jacques Maisonrouge,87,"French businessman, chairman of IBM World Trade Corporation"
James C. Bliss,78,American electrical engineer and entrepreneur
James F. Crow,95,American geneticist
James Farentino,73,"American actor (Dynasty, ER, Melrose Place), sequelae from hip fracture"
James Metcalf,86,American sculptor
James R. Arnold,88,American space scientist
Jan Groover,68,American photographer
Jan Håkan Åberg,95,Swedish organist and composer
Jane Bashara,56,"American marketing manager, strangulation"
Janet Folkes,52,"English academic, cancer"
Janey Buchan,85,"Scottish politician, MEP for Glasgow (1979–1994)"
Jean Pigott,87,"Canadian politician and businesswoman, MP for Ottawa—Carleton (1976–1979)"
Jean Wells,56,American game designer
Jeanne Quint Benoliel,92,American nurse
Jeannette Hamby,78,"American politician, Oregon State Senator (1983–1999), stroke complications and cancer"
Jeffrey Ntuka,26,"South African footballer, stabbed"
Jenny Tomasin,73,"British actress (Upstairs, Downstairs), hypertensive heart disease"
Jerry Poteet,75,American martial arts instructor
Jesus Elbinias,82,Filipino judge
Jim Congrove,65,"American politician, heart complications"
Jim Huber,67,"American sports commentator (CNN, TNT)"
Jim Irwin,77,"American sportscaster (WTMJ), voice of the Green Bay Packers, complications from kidney cancer"
Jim Stanley,76,"American football coach (Oklahoma State Cowboys), cancer"
Jimmy Castor,71,"American funk and R&B saxophonist (""Troglodyte (Cave Man)""), heart failure"
Jiří Bárta,76,Czech pianist and composer
Jiří Raška,70,"Czech ski jumper, Olympic gold medalist (1968), heart disease"
Joaquín Martínez,81,"Mexican-born American actor (Jeremiah Johnson, Die Another Day), pancreatic cancer"
Jock Collaquo,77,Hong Kong hockey player
Jodie-Anne White,44,"Australian dancer and choreographer, artistic director of the Ballet Theatre of Queensland, cancer"
Joe Bygraves,80,Jamaican born British former British Empire heavyweight champion boxer
Joe Paterno,85,"American college football coach (Penn State Nittany Lions), lung cancer"
Johann Carl Vogel,79,South African physicist
John Beech Austin,94,British aviator
John Both Puok,48,South Sudanese politician
John Celardo,93,"American comic strip artist (Tarzan, Buz Sawyer)"
John D. Lowry,79,Canadian film restorer
John David Lewis,56,American political scientist
John F. Baker Jr.,66,American Medal of Honor recipient
John G. Watkins,98,American psychologist
John H. Davis,82,"American author, Alzheimer's disease"
John Hughes,66,American drug counselor
John Levy,99,American jazz double-bassist and manager
John Madin,87,English architect
John Pollock,87,English author
John Rich,86,"American television director (All in the Family, Benson, The Dick Van Dyke Show), heart failure"
Johnny Otis,90,American R&B singer-songwriter
Jonathan Idema,55,"American scam artist, complications from AIDS"
Jorge Andrés Martínez Boero,38,"Argentine motorcycle racer, Dakar Rally crash"
Jorge Wilmot,83,Mexican potter
Josef Brunner,83,German politician
Josef Škvorecký,87,"Czech writer and publisher, cancer"
Joseph Curran,89,American college basketball coach (Canisius)
Joseph Henry Condon,76,"American computer scientist, engineer and physicist"
Joseph Noiret,84,French poet
Joseph T. Collins,72,American herpetologist
José Freire de Oliveira Neto,83,"Brazilian Roman Catholic prelate, Bishop of Mossoró (1984–2004)"
Juan Carlos,66,Spanish footballer
Juan Carlos Gené,82,Argentine actor and playwright
Juan Escudero,91,Spanish footballer
Juan Fremiot Torres Oliver,86,"Puerto Rican Roman Catholic prelate, Bishop of Ponce (1964–2000)"
Juan Sarrachini,65,Argentine footballer
Jugal Kishore,98,Indian physician
Julius Meimberg,95,"German air force pilot (Luftwaffe), recipient of the Knight's Cross of the Iron Cross"
Junsaku Koizumi,87,"Japanese painter and pottery artist, pneumonia"
Kalpana Mohan,65,Indian actress
Kaoru Nishimoto,88,"Japanese shogi player, pneumonia"
Karen Brazell,73,"American academic, professor and translator of Japanese"
Karen Ramey Burns,64,American forensic anthropologist
Karin Aasma,85,Estonian-Swedish art historian
Kartar Singh Duggal,94,Indian writer
Kay Davis,91,American jazz singer
Kazimierz Jasiński,65,"Polish Olympic cyclist, cancer"
Kazimierz Smoleń,91,Polish museum director and Holocaust survivor
Kearney Barton,80,American record producer
Kell Osborne,72,American singer
Kenneth Andrews,90,British historian
Keriman Halis Ece,98,"Turkish beauty pageant queen, pianist and fashion model, Miss Turkey 1932"
Kerry McGregor,37,"British singer and reality contestant (The X Factor), bladder cancer"
Kevin White,82,"American politician, Mayor of Boston (1968–1984)"
King Stitt,71,"Jamaican singer, complications from prostate cancer and diabetes"
Kiro Gligorov,94,"Macedonian politician, first democratically elected President (1991–1999)"
Klaus Goldschlag,89,Canadian ambassador
Kosta Tsonev,82,Bulgarian actor
Kurt Adolff,90,German racing driver
Kyra T. Inachin,43,German historian
L. Basavaraju,92,Indian scholar
L. Ted Coneybeare,86,Canadian TV producer and educational consultant
Larry Butler,69,American music producer
Larry Reinhardt,63,"American rock guitarist (Iron Butterfly, Captain Beyond), liver cirrhosis"
Larry Solway,83,Canadian radio personality and author
Lars Lennart Forsberg,78,Swedish film director
Lasse Kolstad,90,Norwegian actor
Lee Adler,88,American historic preservationist
Lefter Küçükandonyadis,86,"Turkish Olympic footballer (Fenerbahçe) and coach, pneumonia"
Len McIntyre,78,British rugby league player
Leslie Carter,25,"American singer and reality star (House of Carters), drug overdose"
Lila Kaye,82,British actress
Liv Godin,93,Norwegian missionary
Lorna Kesterson,86,"American newspaper editor and journalist (Henderson Home News), Mayor of Henderson, Nevada (1985–1993)"
Louis Boekhout,92,Dutch-born Canadian painter
Louis Rech,85,"Italian-born Luxembourgish politician, Mayor of Dudelange (1985–1993)"
Louise Gibson Annand,96,Scottish artist
Lucy Faulkner,87,Northern Irish journalist
László Szekeres,90,Hungarian physician
M. I. Markose,89,Indian politician
M. O. H. Farook,74,"Indian politician and diplomat, Governor of Kerala (since 2011)"
MS-1,55,"Mexican professional wrestler, car accident"
Mabel Manzotti,73,"Argentine actress (Besos en la Frente, Vidas robadas), complications from a stroke"
Mae Laborde,102,"American actress (Pineapple Express, It's Always Sunny in Philadelphia)"
Malam Bacai Sanhá,64,"Guinea-Bissauan politician, President (1999–2000; since 2009)"
Mani Ram Bagri,91,Indian politician
Manuel Fraga,89,"Spanish politician, President of the Xunta of Galicia (1990–2005), founder of the People's Party and co-father of Spanish Constitution, heart failure"
Marcel De Boodt,85,Belgian academic
