Name,Age,Info
A. Gopalakrishnan,85,Indian nuclear engineer
Abbas Ali Akhtari,82,"Iranian ayatollah, MP (1980–1984, 2004–2008) and member of the Assembly of Experts (since 2020), cancer"
Ada Fisher,74,American physician and politician
Adam Clapham,82,British television director and producer (Doomsday Gun)
Adam Walker,31,"Scottish rugby league player (Hull Kingston Rovers, Wakefield Trinity, national team), suicide"
Adam Zimmer,38,"American football coach (New Orleans Saints, Cincinnati Bengals, Minnesota Vikings), chronic ethanol use disorder"
Adriana Breukink,65,Dutch recorder player and maker
Adriano Moreira,100,"Portuguese lawyer and politician, MP (1980–1995) and member of the council of state (2016–2019)"
Agustín Ramírez,70,Mexican singer-songwriter (Los Caminantes)
Ahmad Akbari,75,Iranian Olympic fencer (1976)
Aksel Nærstad,70,Norwegian politician
Al Hoagland,96,American computer engineer
Al Neiger,83,American baseball player (Philadelphia Phillies)
Al Ries,95,American marketing professional and author
Al Sutton,88,"American anti-racism activist, jazz pianist and actor"
Alan Halsey,73,British poet
Alan Thomson,76,"Australian cricketer (Victoria, national team)"
Alastair Fowler,92,Scottish literary critic and editor
Albert Nolan,88,South African Roman Catholic priest and theologian
Albert Solà,66,Spanish waiter and self-proclaimed illegitimate son of King Juan Carlos I
Alejandra González Pino,54,"Chilean politician, heart failure"
Alejandro Santiago Ciena,44,Puerto Rican music video director
Alexandros Nikolaidis,42,"Greek taekwondo athlete, Olympic silver medalist (2004, 2008), cancer"
Alfredo Chiappori,79,Italian cartoonist
Ali Tehrani,96,Iranian Shia Islamic theologian and writer
Allan Porter,88,American-Swiss photographer and magazine editor (Camera)
Allan Wood,79,"Australian swimmer, Olympic bronze medallist (1964), cancer"
Allison R. Palmer,95,American paleontologist and geologist
Altaf Ahmad Shah,66,"Indian Kashmiri separatist, renal cancer"
Amou Haji,94,"Iranian hermit, known as ""the world's dirtiest man"""
Anatoly Zourpenko,46,"Greek-Russian basketball player (Olympiacos, Papagou, Panellinios)"
Andreas Schnieders,55,German Olympic boxer (1988)
Andrew Dawes,82,Canadian violinist
Andrew Prine,86,"American actor (The Devil's Brigade, Chisum, V)"
Andrzej Magowski,56,"Polish football player (Olimpia Poznań, Herzlake) and coach (Dąb Barcin)"
André Brassard,76,"Canadian film (Once Upon a Time in the East, The Late Blossom) and theatre director"
André Chagnon,94,"Canadian telecommunications executive and philanthropist, founder of Vidéotron"
André Sinédo,44,"New Caledonian footballer (AS Magenta, national team)"
André Spénard,72,"Canadian politician, Quebec MNA (2012–2018)"
Andrés Cuervo,34,Colombian singer-songwriter
Angelo Venosa,68,"Brazilian sculptor, complications from amyotrophic lateral sclerosis"
Angus Trumble,58,"Australian art curator and historian, director of the National Portrait Gallery of Australia (2014–2018)"
Anita Kerr,94,"American singer, Grammy winner (1966, 1967)"
Ankica Tuđman,96,Croatian presidential consort
Ann Flood,89,"American actress (The Edge of Night, From These Roots, Mystic Pizza)"
Ann Savours Shirley,94,British polar exploration historian
Ann-Christine Nyström,78,Finnish singer
Anna McCurley,79,"Scottish politician, MP (1983–1987)"
Anna Wahlgren,80,Swedish author
Anne Edwards,87,Canadian politician
Annie Shekhar,84,"Indian politician, Maharashtra MLA (2004–2014)"
Anthony Ortega,94,"American jazz clarinetist, saxophonist and flautist"
Anton Donchev,92,Bulgarian writer (Time of Parting)
Antonio Del Prete,87,"Italian lawyer and politician, senator (1983–1987), deputy (1994–1996)"
Antonio Inoki,79,"Japanese Hall of Fame professional wrestler (NJPW), wrestling promoter, and politician, MP (1989–1995, 2013–2019), amyloidosis"
Araz Alizadeh,70,"Azerbaijani politician, people's deputy (1991–1995)"
Aristidis Rapanakis,68,"Greek sailor, Olympic bronze medalist (1980)"
Aristotelis Pavlidis,78,"Greek politician, minister for the Aegean (2004–2007)"
Arshad Sharif,49,"Pakistani investigative journalist (ARY News, Aaj News, Dunya News), shot"
Art Laboe,97,"American disc jockey (KXLA, KPOP), founder of Original Sound Records, pneumonia"
Arthur Bernard,82,"French author, academic, and historian"
Arun Bali,79,"Indian actor (Chanakya, Swabhimaan, Hey Ram)"
Ash Carter,68,"American politician, secretary of defense (2015–2017), heart attack"
Asher Tlalim,72,"Israeli filmmaker, cancer"
Ashot Sarkisov,98,"Russian nuclear physicist, member of the Russian Academy of Sciences (since 1994)"
Atarah Ben-Tovim,82,"British flautist, cancer"
Atlas Ramachandran,80,"Indian jeweller, film producer (Vaisali, Sukrutham) and actor"
Austin Stoker,92,"Trinidadian-American actor (Assault on Precinct 13, Battle for the Planet of the Apes, Abby), kidney failure"
Avtar Singh Jouhl,84,Indian-born British anti-racism campaigner and lecturer
Aïda Ba,39,"French rugby union player (national team), breast cancer"
Bahaa Taher,87,Egyptian novelist
Barbara Brennan,83,American author and spiritual healer
Barbara Cooper,93,"American politician, member of the Tennessee House of Representatives (since 1996)"
Barbara Stamm,77,"German politician, member (1976–2018) and president (2008–2018) of the Landtag of Bavaria"
Barry L. Zaret,82,"American cardiologist, traffic collision"
Ben Feigin,47,"American television producer (Schitt's Creek, Cheech & Chong: Roasted), Emmy winner (2020), pancreatic cancer"
Ben Stevens,63,"American politician, member (2001–2007) and president (2005–2007) of the Alaska Senate"
Benita Senn,93,Canadian tennis player
Benjamin Civiletti,87,"American lawyer, attorney general (1979–1981) and deputy attorney general (1978–1979), complications from Parkinson's disease"
Benno Zech,94,"German teacher and politician, member of the Landtag of Rhineland-Palatinate (1983–1987)"
Bernard Atha,94,"English actor (Kes, Coronation Street) and politician, mayor of Leeds (2000–2001)"
Bernard McGuirk,64,"American radio personality, brain cancer"
Bernardo Adam Ferrero,80,"Spanish composer, conductor and musicologist"
Beryl Benacerraf,73,"American radiologist, cancer"
Beryl Goldwyn,91,"English ballet dancer, breast cancer"
Bettye Crutcher,83,"American songwriter (""Who's Making Love"")"
Bhanwar Lal Sharma,77,"Indian politician, Rajasthan MLA (1985–1993, 1996–2008, since 2013)"
Bill Brewster,80,"American politician, member of the U.S. House of Representatives (1991–1997) and Oklahoma House of Representatives (1983–1990)"
Bill Brison,92,English Anglican priest
Bill Nieder,89,"American shot putter, Olympic champion (1960)"
Bill Whitaker,63,"American football player (Green Bay Packers, St. Louis Cardinals)"
Billur Kalkavan,59,"Turkish actress (The Blue Exile, The Queen Is in the Factory, Acayip Hikayeler), lung cancer"
Billy Al Bengston,88,American visual artist and sculptor
Billy Newman,75,"Irish footballer (Shelbourne, national team)"
Bjarne Mørk Eidem,85,"Norwegian politician, MP (1969–1993), minister of fisheries (1986–1989) and auditor general (1990–2005)"
Blanche Lemco van Ginkel,98,British-born Canadian architect and city planner
Bob Berry,92,American government official
Bob Ellicott,95,"Australian jurist and politician, attorney-general (1975–1977), MP (1974–1981) and minister for home affairs (1977–1981)"
Bob Giallombardo,85,American baseball player (Los Angeles Dodgers)
Bob Lusk,90,American football player (Detroit Lions)
Borys Bespalyi,69,"Ukrainian politician, MP (1998–2007)"
Branislav Hronec,81,"Slovak composer, pianist and conductor"
Brenda MacGibbon,78,"Canadian mathematician and statistician, complications from Alzheimer's disease and ALS"
Brian Robinson,91,British road racing cyclist
Bruce E. Young,76,American politician
Bruce Pairaudeau,91,"Guyanese-New Zealand cricketer (British Guyana, Northern Districts, West Indies)"
Bruce Sutter,69,"American Hall of Fame baseball player (Chicago Cubs, St. Louis Cardinals, Atlanta Braves), cancer"
Bruno Latour,75,"French philosopher and sociologist (Laboratory Life, Science in Action, We Have Never Been Modern), pancreatic cancer"
Bryan Gossman,71,Scottish rugby union player
Brígida Baltar,62,"Brazilian visual artist, leukemia"
Burt Gustafson,96,American football coach (Green Bay Packers)
Burton MacDonald,83,"Canadian biblical archaeologist, leukemia"
Béla Szakcsi Lakatos,79,Hungarian pianist and composer
Bülend Özveren,79,Turkish television presenter and sports commentator
Calvin O. Butts,73,"American pastor and academic administrator, president of the State University of New York at Old Westbury (1999–2020)"
Camille Ziade,79,"Lebanese politician, MP (1992–2000)"
Carl Fredrik Bunæs,82,Norwegian Olympic sprinter (1960)
Carl Ryves,82,Australian Olympic sailor
Carl Walker,88,British police inspector
Carlos Melancia,95,"Portuguese politician, governor of Macau (1987–1991)"
Carlos de la Rosa,78,"Argentine lawyer and politician, senator (1995–2001)"
Carmelo Ríos,63,Puerto Rican Olympic athlete (1984)
Carroll McClure Lewin,79,American anthropologist
Cassius Turvey,15,"Australian teenager, injuries from assault"
Cees Lute,81,Dutch racing cyclist
Charles A. Clarke,80,Liberian politician
Charles Duncan Jr.,96,"American businessman and politician, secretary of energy (1979–1981) and president of the Coca-Cola Company (1972–1974), complications from a fall"
Charles F. Stevens,88,American neuroscientist
Charles Fuller,83,"American playwright (A Soldier's Play, Zooman and the Sign), Pulitzer winner (1982)"
Charles Sherrod,85,American civil rights activist
Charles Wheeler,96,"American politician, member of the Missouri Senate (2003–2007) and mayor of Kansas City, Missouri (1971–1979)"
Charley Cobb,92,American football coach
Charley Trippi,100,American Hall of Fame football player (Chicago Cardinals)
Charlie Brown,80,American DJ (WKIX) and radio presenter
Charlie Smithgall,77,"American politician, mayor of Lancaster, Pennsylvania (1998–2006), heart disease"
Cheryl Roberts,60,"South African Olympic table tennis player (1992), cancer"
Chris Harris,89,English-born American basketball player (St. Louis Hawks)
Christine Farnon,97,American music industry executive (NARAS)
Chuck Bradley,71,"American football player (San Diego Chargers, Miami Dolphins, Chicago Bears)"
Chuck Deardorf,68,"American jazz musician, COVID-19"
Claude Saunier,79,"French politician, mayor of Saint-Brieuc (1983–2001) and senator (1989–2008), cardiac arrest"
Claudio Biern Boyd,81,"Spanish animator (The World of David the Gnome, Gladiator Academy), founder of BRB Internacional"
Clerence Chyntia Audry,28,"Indonesian actress (Anak Jalanan), blood cancer"
Colin Alevras,51,"American restaurateur, glioblastoma"
Conrad Landry,83,"Canadian politician, New Brunswick MLA (1978–1995)"
Constance Jordan Wilson,71,American urban planner
Curt Gentry,81,American football player (Chicago Bears) and coach
Cynthia Lai,68,"Hong Kong-born Canadian politician, Toronto city councillor (since 2018), gallbladder cancer"
Cyrus Mann,66,"American basketball player (Crispa Redmanizers), COVID-19"
César Mascetti,80,Argentine journalist and television news host (Telenoche)
D. H. Peligro,63,"American drummer (Dead Kennedys, Red Hot Chili Peppers), combined drug intoxication"
Dagmar Rom,94,"Austrian skier, Olympic silver medallist (1952)"
Dame Angela Lansbury,96,"British-American-Irish actress (The Manchurian Candidate, Sweeney Todd, Murder, She Wrote) and singer, five-time Tony winner"
Dame Carmen Callil,84,"Australian publisher, founder of Virago Press, leukaemia"
Dan Dougherty,87,American basketball coach
Dan Flynn,79,"American politician, businessman and rancher, member of the Texas House of Representatives (2003–2021)"
Daniel B. Drachman,90,"American neurologist, heart attack"
Daniel Hwang,69,"Taiwanese politician, member of the Legislative Yuan (1999–2012)"
Daniel Schmutz,79,"Swiss administrator and politician, Vaud state councillor (1981–1998)"
Danny Javier,75,Filipino musician (APO Hiking Society)
Dariusz Raczyński,60,Polish footballer (Lechia Gdańsk)
Darshan Dharmaraj,41,"Sri Lankan actor (Prabhakaran, Ini Avan, Address Na), heart attack"
Dave Dryden,81,"Canadian ice hockey player (New York Rangers, Chicago Blackhawks, Buffalo Sabres)"
Dave Herman,81,American football player (New York Jets)
David Beckwith,79,"American journalist, lung cancer"
David Huerta,72,"Mexican poet, kidney failure"
David O'Connor,84,Australian-American Egyptologist
David Scott,75,English poet
Dennis Nyback,69,"American independent film archivist and filmmaker, cancer"
Dick Ellsworth,82,"American baseball player (Chicago Cubs, Boston Red Sox, Cleveland Indians)"
Dick Horn,92,American football player (Baltimore Colts) and pediatrician
Dieter Dieckhoff,93,"German farmer and politician, member of the Landtag of Lower Saxony (1974–1990)"
Dieter Werkmüller,85,German academic and lawyer
Dietrich Mateschitz,78,"Austrian businessman, co-founder of Red Bull GmbH"
Dilip Mahalanabis,87,Indian pediatrician
Dina Merhav,86,Yugoslav-born Israeli sculptor
Ding Wenchang,89,Chinese air force officer
Dolores Mertz,94,American politician
Dolores Sloviter,90,"American jurist, judge of the U.S. Court of Appeals for the Third Circuit (since 1979)"
Domenico Contestabile,85,"Italian lawyer and politician, senator (1994–2006)"
Don Edwards,86,American cowboy singer and actor (The Horse Whisperer)
Donal Moynihan,81,"Irish politician, TD (1982–1989, 1992–2007)"
Donald Hill Perkins,97,British physicist
Donato Manfroi,82,"Italian politician, senator (1992–2001)"
Doris Margaret Anderson,100,"Canadian politician, senator (1995–1997)"
Doru Ana,68,"Romanian actor (The Man of the Day, Next Stop Paradise, Stuff and Dough)"
Doug Brignole,63,"American bodybuilder, COVID-19"
Doug Langway,52,"American screenwriter and film director (BearCity), liver cancer"
Douglas Kirkland,88,Canadian-American photographer
Dália da Cunha-Sammer,93,"Portuguese Olympic gymnast (1952, 1960)"
Eamonn McCabe,74,British photographer
Earl Strinden,90,"American politician, member of the North Dakota House of Representatives (1967–1989)"
Ed Argast,66,American college football coach
Ed Olivares,84,Puerto Rican baseball player (St. Louis Cardinals)
Eddie Robertson,103,New Zealand geophysicist
Eileen Ryan,94,"American actress (Magnolia, Parenthood, Benny & Joon)"
Ekow Blankson,50,"Ghanaian actor (Checkmate, Sun City)"
Eleanor Moore,88,"American baseball player (Fort Wayne Daisies, Grand Rapids Chicks), complications from pneumonia"
Elizabeth Stewart,83,Scottish singer
Ellsworth Kingery,93,American football player (Chicago Cardinals)
Emeric Arus,84,Romanian Olympic fencer (1960)
Eric Crone,75,Danish film producer
Eric Jean Baptiste,52,"Haitian politician and entrepreneur, shot"
Esmayeel Shroff,62,"Indian film director (Thodisi Bewafaii, God and Gun, Police Public)"
Esther Peter-Davis,90,French human rights activist and environmentalist
Ethevaldo Mello de Siqueira,90,"Brazilian journalist, science writer, and consultant"
Eugen Simion,89,Romanian essayist and historian
Fa'afiaula Sagote,41,Samoan actor (The Orator)
Fabián Ríos,58,"Argentine politician, senator (2003–2009) and deputy (2011–2013), heart failure"
Farquhar Wilkinson,90,"New Zealand cellist, principal cellist of the New Zealand Symphony Orchestra (1955–1992)"
Faustino López Vargas,64,"Mexican politician, senator (since 2022), traffic collision"
Felicitas Kuhn,96,Austrian children's book illustrator
Feliks W. Kres,56,Polish writer
Ferdinando Facchiano,95,"Italian lawyer and politician, deputy (1987–1994), minister for cultural and environmental heritage (1989–1991)"
Fernando González Gortázar,79,"Mexican architect, sculptor and writer"
Florin Zalomir,41,"Romanian fencer, Olympic silver medallist (2012)"
Frances Muñoz,92,"American judge, cardiac arrest"
Franco Stradella,81,"Italian businessman and politician, deputy (1996–2013)"
Frank Reid,76,"Canadian football player (Ottawa Rough Riders, Winnipeg Blue Bombers)"
Frank Youso,86,"American football player (New York Giants, Minnesota Vikings, Oakland Raiders)"
Frankie Wilson,52,"Northern Irish Gaelic footballer (Antrim), bile duct cancer"
František Vršovský,89,Czech Olympic sprint canoeist
Franz Vorrath,85,"German Roman Catholic prelate, auxiliary bishop of Essen (1995–2014)"
François Chesnais,88,French economist
François Iselin,82,Swiss architect and writer
François Remetter,94,"French footballer (Strasbourg, Metz, national team)"
Fred Catero,89,American record producer and engineer
Fred Martin,95,American artist
Fritz Huitfeldt,83,Norwegian lawyer and politician
Frøydis Armand,73,"Norwegian actress (Wives – Ten Years After, Hotel Cæsar)"
Funminiyi Afuye,66,"Nigerian lawyer and politician, member (2007–2011, since 2019) and speaker (since 2019) of the Ekiti State House of Assembly"
Fuzzy,83,Danish composer (Eight Hours Don't Make a Day)
Gabriela Cárdeñas,64,Peruvian Olympic volleyball player
Gabrielle Beaumont,80,"British television director (Diana: A Tribute to the People's Princess, Star Trek: The Next Generation, Remington Steele)"
Galina Pisarenko,88,"Russian opera singer (Stanislavski and Nemirovich-Danchenko Theatre, Komische Oper Berlin) and voice teacher (Moscow Conservatory)"
Gary A. Lee,89,"American politician, member of the U.S. House of Representatives (1979–1983) and New York State Assembly (1975–1979)"
Gentil Delázari,82,"Brazilian Roman Catholic prelate, bishop of Sinop (1995–2016)"
Geoff Feehan,87,"Australian footballer (St Kilda, Norwood)"
Georg Scholz,64,"German medical officer and politician, member of the Landtag of North Rhine-Westphalia (2000–2005)"
George Forbes,78,"Scottish businessman, chairman of Newcastle United"
George Johanson,94,"American painter, printmaker, and ceramic tile artist"
George Katz,96,American pianist
George Nedungatt,89,Indian Jesuit priest and canonist
George Nelson Hunt III,90,"American Episcopal prelate, bishop of Rhode Island (1980–1994)"
George Saurman,96,"American politician, member of the Pennsylvania House of Representatives (1981–1994)"
Gerald Stern,97,American poet
Geraldine Hunt,77,"American R&B singer (""Can't Fake the Feeling"")"
Gerard Lautenschutz,93,Dutch Olympic sailor
Gerben Karstens,80,"Dutch racing cyclist, Olympic champion (1964), complications from a stroke"
Gerrit van der Linde,95,"Dutch jurist, justice of the Supreme Court (1981–1997)"
Gian Piero Ventrone,62,"Italian football fitness coach (Juventus, Tottenham Hotspur, national team), acute myeloid leukemia"
Gordon Beattie Martin,90,"Canadian sportscaster and politician, Saskatchewan MLA (1986–1991)"
Gordon Fee,88,American Christian theologian
Gordon Mydland,100,"American politician, attorney general of South Dakota (1969–1973) and member of South Dakota Senate (1963–1968)"
Grace Glueck,96,"American arts journalist (The New York Times, The New Criterion, Los Angeles Review of Books)"
Gus Stavros,97,American businessman and philanthropist
Guy Avanzini,93,French academic and philosopher
Günter Lamprecht,92,"German actor (Berlin Alexanderplatz, Das Boot, World on a Wire)"
Günter Vetter,86,Austrian politician
Hal Jones,89,Canadian ice hockey player (Trail Smoke Eaters)
Halit Kıvanç,97,"Turkish journalist (Milliyet, Tercüman, Hürriyet), television and radio presenter"
Halvor Næs,94,"Norwegian Olympic ski jumper (1952, 1960)"
Hank Weber,97,"American politician, member of the North Dakota Senate (1965–1966) and House of Representatives (1963–1964, 1967–1980)"
Hannah Pick-Goslar,93,German-born Israeli Holocaust survivor (Laatste Zeven Maanden van Anne Frank)
Hans Berger,84,"German trade unionist and politician, MP (1990–1994), president of the Union of Mining and Energy (1990–1997)"
Hans Lagerwall,81,"Swedish Olympic fencer (1960, 1964)"
Hans Ulrich Baumberger,90,"Swiss entrepreneur and politician, councillor (1971–1975), member of the Council of States (1975–1983)"
Harold Garde,99,American painter
Harold Wippler,94,American violinist
Harry Lehman,87,"American politician, member of the Ohio House of Representatives (1971–1980)"
Harry White,78,Australian jockey
Harvey Wollman,87,"American politician, governor (1978–1979) and lieutenant governor (1975–1978) of South Dakota, member of the South Dakota Senate (1968–1970)"
Hava Pinhas-Cohen,67,Israeli poet and writer
Heinrich Schneier,96,"German politician, member of the Landtag of Bavaria (1962–1974)"
Heinz Winkler,73,"Italian-German chef, multiple organ failure"
Heinz-Jörg Eckhold,81,"German politician, member of the Landtag of North Rhine-Westphalia (1995–2005)"
Helen Michaluk,92,"Belarusian activist, chair of the Association of Belarusians in Great Britain (1997–2013)"
Helena Łazarska,88,Polish operatic and vocal pedagogue
Helga Dudzinski,93,German Olympic figure skater
Helge Törn,93,Finnish Olympic cyclist (1952)
Helmut Kuhlmann,82,"German politician, member of the Landtag of Lower Saxony (1974–1998)"
Helmut Moritz,88,Austrian physical geodesist
Henri Le Breton,94,"French politician, senator (1981–2001), mayor of Buléon (1953–2008)"
Herbert Chabot,91,"American jurist, judge of the United States Tax Court (1978–2016), complications from COVID-19"
Herman Daly,84,American economist
Hikaru Matsunaga,93,"Japanese politician, minister of finance (1998), international trade (1989–1990) and education (1984–1985)"
Horst Hülß,84,"German football player (Viktoria Köln, 1. FSV Mainz 05) and manager (SV Wiesbaden)"
Horst Metz,77,"German politician, member of the Landtag of Saxony (1990–2009)"
Howard Tripp,95,"British Roman Catholic prelate, titular bishop of Newport and auxiliary bishop of Southwark (1980–2004)"
Hsu Yung Chin,70,Taiwanese calligrapher
Hugh McKean,55,"American politician, member of the Colorado House of Representatives (since 2017), heart attack"
Hugo Camps,79,"Belgian journalist, columnist and writer"
Humphrey Bamisebi Olumakaiye,53,"Nigerian Anglican prelate, bishop of Lagos (since 2018)"
Husnija Arapović,78,"Bosnian football player (Čelik Zenica, Borac Banja Luka) and manager (Schaffhausen)"
Husnija Fazlić,79,"Bosnian football player (1. FC Saarbrücken, Borac Banja Luka) and manager (SD Croatia Berlin)"
Iain Rice,74,British model railway enthusiast and writer
Ian Angus,96,British librarian and editor
Ian Hamilton,97,Scottish lawyer and independence activist (1950 removal of the Stone of Scone)
Ian Jack,77,"British journalist (Granta, The Guardian) and writer"
Ian MacLeod,77,Canadian football player (Edmonton Eskimos)
Ian Whittaker,94,"British set decorator (Alien, Howards End) and actor (The Revenge of Frankenstein), Oscar winner (1993), prostate cancer"
Ibrahim Zukanović,64,"Bosnian football player (Čelik Zenica) and manager (Sloga Uskoplje, Iskra Bugojno)"
Imre Forgács,73,"Hungarian jurist, minister of justice (2009–2010)"
Irakli Khakhubia,51,"Georgian economist, engineer, and politician"
Ivan Wolffers,74,"Dutch writer and physician, prostate cancer"
Ivy Jo Hunter,82,"American songwriter (""Behind a Painted Smile"", ""Loving You Is Sweeter Than Ever"", ""Dancing in the Street"")"
Jack Diamond,89,South African-born Canadian architect
Jack Terry,92,Polish-American author and Holocaust survivor
Jack Thiessen,91,Canadian lexicographer
Jackie LaVine,93,American Olympic swimmer
Jacques Brault,89,Canadian poet and translator
Jacques Cresta,67,"French politician, deputy (2012–2017)"
Jagoda Buić,92,Croatian visual artist
James Giffen,81,American businessman
James M. Derham,74,American diplomat
James McDivitt,93,"American astronaut (Gemini 4, Apollo 9)"
James Roose-Evans,94,"British theatre director, priest and writer"
James Wright,83,"American historian, president of Dartmouth College (1998–2009)"
Jamshed Jiji Irani,86,"Indian steel industrialist, director of Tata Steel (1998–2001)"
Jan Rabson,68,"American voice actor (Akira, Leisure Suit Larry, James Bond Jr.), heart attack"
Jan van der Graaf,85,"Dutch church administrator, general secretary of the Reformed Association in the Protestant Church in the Netherlands (1973–2001)"
Janel Mueller,83,American academic
Janet Thurlow,96,"American jazz singer, heart failure"
Janice Gates,57,American yoga instructor and therapist
Jaroslav Čejka,86,"Czech dancer, mime, and actor"
Jay Owen Light,81,American academic administrator
Jean Gallois,93,French musicologist
Jean Teulé,69,"French novelist (The Suicide Shop), cartoonist, and screenwriter, cardiac arrest"
Jean-Louis Pelletier,86,French criminal lawyer
Jean-Pierre Machelon,77,French academic and jurist
Jeff Barnaby,46,"Canadian film director (Rhymes for Young Ghouls, Blood Quantum), cancer"
Jeff Jordan,78,American football player (Minnesota Vikings)
Jeremy Mansfield,59,"South African radio presenter (Radio 702, 947), liver cancer"
Jeremy Rogers,85,"British boat builder and sailor, complications of Alzheimer's disease and COVID-19"
Jerry Lee Lewis,87,"American Hall of Fame singer (""Great Balls of Fire"", ""Whole Lotta Shakin' Going On"", ""High School Confidential"") and pianist"
Jerry Vainisi,80,American football executive (Chicago Bears)
Jerzy Urban,89,"Polish journalist (Polityka, Nie) and writer"
Jesús Quintero,82,"Spanish journalist, respiratory failure"
Jesús del Muro,84,"Mexican football player (Atlas, national team) and manager (Jalisco)"
Jim Bailey,87,American baseball player (Cincinnati Reds)
Jim Bolla,70,"American college basketball coach (UNLV Lady Rebels, Hawaii Rainbow Wahine)"
Jim Carter,103,New Zealand musician
Jim Halligan,86,"American academic administrator (Oklahoma State University) and politician, member of the Oklahoma Senate (2008–2016)"
Jim Niekamp,76,American ice hockey player (Detroit Red Wings)
Jim Redmond,81,Trinidadian-British engineer
Jim Sweeney,60,"American football player (New York Jets, Pittsburgh Steelers, Seattle Seahawks) and coach"
