Name,Age,Info
Tony Street,96,"Australian politician, minister for foreign affairs (1980–1983) and MP (1966–1984)"
Toru Ohno,87,Japanese literary scholar
Toshi Ichiyanagi,89,Japanese composer and pianist
Travis Basevi,47,"Australian cricket statistician and historian, cancer"
Tsin Ting,88,"Taiwanese singer and voice actress (Diau Charn, The Love Eterne, The Mermaid)"
Tullio Pozzan,73,Italian biochemist
Tulsi Tanti,64,"Indian renewable energy executive, founder of Suzlon, cardiac arrest"
Tyrone Davis,50,"American football player (Green Bay Packers, New York Jets)"
Umberto Bellocco,84,"Italian mobster, founder of Bellocco 'ndrina"
Urs Nussbaumer,91,"Swiss agronomic engineer and politician, councilor (1979–1991)"
Vage Shakhverdyan,77,"Armenian stage director and politician, MP (1995–1999)"
Vaishali Takkar,30,"Indian actress (Sasural Simar Ka, Super Sisters - Chalega Pyar Ka Jaadu, Vish Ya Amrit: Sitara), suicide by hanging"
Val Joyce,91,Irish radio broadcaster
Valery Rubakov,67,"Russian theoretical physicist, member of the Russian Academy of Sciences (since 1998), complications from COVID-19"
Vanilla Beane,103,American milliner and fashion designer
Verckys Kiamuangana Mateta,78,Congolese saxophonist and composer
Victor Steeman,22,"Dutch motorcycle racer, injuries sustained in race collision"
Vidmantas Bačiulis,82,Lithuanian screenwriter and film director
Viktor Donskikh,87,"Russian politician, deputy (1991–1993)"
Viktor Logunov,78,"Russian track cyclist, Olympic silver medalist (1964)"
Vinayak Nimhan,59,"Indian politician, Maharashtra MLA (1999–2014), cancer"
Vince Dooley,90,American Hall of Fame college football coach (Georgia Bulldogs)
Vincent Eze Ogbulafor,73,Nigerian politician
Vladimir Gligorov,77,Serbian economist
Vladimir Kostrov,87,"Russian poet, translator and playwright"
Vladimir Kulakov,86,Belarusian politician
Vladimir Kuts,94,Russian World War II veteran
Waldemar Fibigr,56,"Czech Olympic sprint canoer (1988, 1992)"
Walt Corey,84,"American football player and coach (Kansas City Chiefs, Buffalo Bills)"
Walter Dean Burnham,92,"American political scientist and author (Presidential Ballots, 1836–1892)"
Walter Gaudnek,91,German artist
Walter Schröder,89,"German rower, Olympic champion (1960)"
Walter Steinegger,93,Austrian Olympic ski jumper
Wang Hongfan,89,"Chinese politician, member of the National People's Congress (1993–1998)"
War of Attrition,23,"Irish racehorse, Cheltenham Gold Cup winner (2006)"
Warren J. Baker,84,"American academic administrator, president of Cal Poly San Luis Obispo (1979–2010)"
Wendy Smits,39,"Dutch handball player (TuS Metzingen, HSG Blomberg-Lippe, national team)"
William Armstrong Percy III,88,American historian and gay activist
William G. Borchert,89,American screenwriter (My Name Is Bill W.)
William H. Rowden,92,American vice admiral
William March,85,American Olympic weightlifter
William Sheldrick Conover,94,"American politician, member of the U.S. House of Representatives (1972–1973)"
William W. Hay,88,American geologist
Willie Spence,23,"American singer (American Idol), traffic collision"
Willy Padrutt,94,Swiss jurist
Wolfgang Haken,94,German-American mathematician
Wolfgang Jenssen,80,"German politician, member of the Landtag of Rhineland-Palatinate (1971–1979)"
Wolfgang Kohlhaase,91,"German screenwriter (I Was Nineteen, Mama, I'm Alive) and film director (Solo Sunny)"
Wolfgang Lange,84,"German Olympic canoeist (1960, 1968)"
Xu Guangchun,77,"Chinese politician, CPC secretary of Henan (2004–2009)"
Yoshiki Hiki,89,Japanese Olympic rower (1956)
Yoshimi Osawa,96,"Japanese judoka, pneumonia"
Younoussi Touré,80,"Malian politician, prime minister (1992–1993) and president of the National Assembly (2012–2013)"
Yuri Kosin,74,Ukrainian photographer
Yuri Zubakov,78,Russian politician
Yuriy Dehteryov,74,"Ukrainian footballer (Shakhtar Donetsk, Soviet Union national team)"
Yury Klimov,82,"Russian handball player and coach, Olympic champion (1976)"
Yūko Katagiri,70,"Japanese actress (Gassan), bile duct cancer"
Zbigniew Senkowski,66,"Polish trade union activist and politician, deputy (1997–2001)"
Zhaneta Andrea,85,Albanian archeologist
Zhang Qiusheng,83,Chinese children's book writer
Zita Leeson Weinshienk,89,"American jurist, judge of the U.S. District Court of Colorado (1979–2011)"
Àngel Casas,76,"Spanish journalist, television talk show host and writer, calciphylaxis"
Éder Jofre,86,"Brazilian Hall of Fame boxer, world bantamweight (1960–1965) and WBC featherweight (1973–1974) champion, complications from pneumonia"
Étienne Gaboury,92,"Canadian architect (Precious Blood Roman Catholic Church, Saint Boniface Cathedral, Esplanade Riel)"
Ștefan Ionescu,87,"Romanian Olympic ice hockey player (1964, 1968)"
