Name,Age,Info
Tom Reed,77,"American college football player and coach (Miami University Redskins, North Carolina State Wolfpack)"
Tom Urbani,54,"American baseball player (St. Louis Cardinals, Detroit Tigers)"
Tomasz Wołek,74,Polish journalist and sports commentator
Tony Brown,77,English darts player
Tony L. Bennett,82,"American police officer and politician, member of the Minnesota House of Representatives (1971–1974, 1983–1990)"
Torhild Bransdal,66,"Norwegian politician, MP (2017–2021) and mayor of Vennesla (1999–2017)"
Toshiko Taira,101,Japanese textile artist
Trevor Tomkins,81,British jazz drummer (Gilgamesh)
Tu Zhen,88,Chinese translator
Umesh Katti,61,"Indian politician, Karnataka MLA (1985–2004, since 2008), cardiac arrest"
Vadim Filimonov,91,"Russian legal scholar and politician, deputy (1993–1999)"
Vadim Utkin,84,Russian-American control theorist and electrical engineer
Valeri Polyakov,80,"Russian cosmonaut (Mir EO-3, Mir EO-4)"
Valerie Maynard,85,American sculptor
Venetia Stevenson,84,"English-American actress (Day of the Outlaw, Seven Ways from Sundown, The Sergeant Was a Lady), complications from Parkinson's disease"
Vernon Burch,67,American singer and guitarist
Vernon Dvorak,93,American meteorologist
Vernon Heywood,94,British botanist
Vic Kohring,64,"American politician, member of the Alaska House of Representatives (1995–2007), traffic collision"
Victor G. Springer,94,American biologist
Vincent Deporter,63,Belgian comic book artist and animator (SpongeBob Comics)
Vincent Di Maio,81,"American pathologist, complications from COVID-19"
Virginia Dwan,90,American art collector and patron
Virginio Rognoni,98,"Italian politician, minister of the interior (1978–1983), justice (1986–1987) and defence (1990–1992)"
Vladimir Golubev,72,"Russian football player (Zenit, Soviet Union national team) and manager"
Vladimir Krasnopolsky,89,"Russian film director (The Slowest Train, Not Under the Jurisdiction, Eternal Call), screenwriter and producer"
Vladimir Petercă,78,Romanian Roman Catholic theologian
Vladimir Sungorkin,68,Russian journalist and media manager
Vlado Milunić,81,Yugoslav-born Czech architect (Dancing House)
Väinö Vilponiemi,96,"Finnish politician, MP (1962–1975)"
W. David McIntyre,90,British-born New Zealand historian
W. Neal Moerschel,91,American politician
Wally Tatomir,76,Canadian-born American ice hockey equipment manager (Carolina Hurricanes) and inventor
Walter Suggs,83,American football player (Houston Oilers)
Wang Wei,48,"Chinese politician, member of the National People's Congress (since 2018)"
Wayne Garfield,70,American composer and songwriter
Wendell Lady,91,"American politician, member (1969–1983) and speaker (1979–1983) of the Kansas House of Representatives"
Werner Loewe,81,"German politician, member of the Hamburg Parliament (1978–1986)"
Wes Freed,58,"American outsider artist, colorectal cancer"
Willard N. Young,95,American politician
William D. Hyslop,71,"American lawyer, U.S. attorney for the Eastern District of Washington (1991–1993, 2019–2021)"
William K. Barlow,86,"American politician, pancreatic cancer"
William Klein,96,"American-born French photographer, film director, and screenwriter (Who Are You, Polly Maggoo?, Mr. Freedom, The Model Couple)"
William Rivers Pitt,50,American author
Willie Los'e,55,"New Zealand-born Tongan rugby union player (Auckland, North Harbour, Tonga national team) and broadcaster"
Willy Soemita,86,"Surinamese politician, deputy vice president (1988–1990)"
Wong Phui Nam,87,Malaysian economist and poet
Yadollah Royaee,90,Iranian poet
Yakov Gorelnikov,74,"Kazakh actor and politician, deputy (1994–1995)"
Yang Yongsong,103,Chinese military officer
Yoel Schwartz,82,Israeli Haredi rabbi
Yousuf Mustikhan,74,"Pakistani politician, liver cancer"
Yuki Onishi,43,"Japanese chef, heart failure"
Yuri Bashkatov,54,"Moldovan swimmer, Olympic silver medalist (1988, 1992)"
Yury Zaitsev,71,"Russian weightlifter, Olympic champion (1976)"
Yusuf al-Qaradawi,96,"Egyptian Islamic scholar (The Lawful and the Prohibited in Islam), chairman of IUMS (since 2004)"
Yvon Lafrance,78,"Canadian politician, Quebec MNA (1989–1994)"
Zack Estrin,51,"American television writer and producer (Prison Break, Charmed, Lost in Space)"
Zahos Hadjifotiou,99,"Greek businessman, journalist and author"
Zenno Rob Roy,22,"Japanese Thoroughbred racehorse, heart failure"
Zhan Bingyan,93,"Chinese urologist and politician, member of the National People's Congress (1993–1998)"
Zhang Chuanmiao,85,"Chinese military officer and politician, member of the National People's Congress (1993–1998)"
Zhu Yinghao,93,Chinese transformer expert
Zulema Dene,88,"English actress (Willow, Emergency Ward 10, Coronation Street)"
Émile Antonio,94,"French footballer (FC Sète, OGC Nice, Olympique Lyonnais)"
Ľubomír Dobrík,70,"Slovak judge, member of the Constitutional Court of Slovakia (1997–2016)"
Ľudovít Komadel,94,Slovak Olympic swimmer (1952) and sports physician
