Name,Age,Info
Stuart Hood,95,"Scottish writer and television executive, controller of BBC Television (1961–1964)"
Suchitra Mitra,86,"Indian singer, cardiac arrest"
Sun Axelsson,75,Swedish novelist
Susana Chávez,36,"Mexican poet and human rights activist, strangled"
Susannah York,72,"English actress (Tom Jones, Superman, They Shoot Horses, Don't They?), bone marrow cancer"
Sushil Kumar Dhara,99,Indian revolutionary
Svein Mathisen,58,"Norwegian footballer (IK Start), cancer"
Szeto Wah,79,"Hong Kong political activist, lung cancer"
Tally Monastyryov,71,Soviet Olympic skier
Terje Sagvolden,65,Norwegian neuroscientist
Theoni V. Aldredge,88,"Greek-born American costume designer (Ghostbusters, Network, The Great Gatsby), Oscar winner (1975)"
Thorbjørn Svenssen,86,"Norwegian footballer, record 104 appearances for the national team, stroke"
Tom Cavanagh,28,"American ice hockey player (San Jose Sharks), blunt force trauma"
Tony Geiss,86,"American television writer and composer (Sesame Street), Emmy award winner, complications from a fall"
Tore Sjöstrand,89,Swedish Olympic gold medal-winning (1948) athlete
Toshiyuki Hosokawa,70,"Japanese actor, acute subdural hematoma"
Tullia Zevi,91,"Italian journalist and politician, leader of the Italian Jewish community"
Tuviah Friedman,88,Israeli Nazi hunter
Tøger Seidenfaden,53,"Danish newspaper editor-in-chief (Politiken), cancer"
Uche Okafor,43,"Nigerian footballer, murdered"
Val Puccio,45,American professional wrestler
Vang Pao,81,"Lao army general and Hmong community leader, Commander of the Secret Army, pneumonia"
Vaughn Mancha,89,"American football player (Boston Yanks), heart failure"
Vern Kaiser,85,Canadian ice hockey player (Montreal Canadiens)
Verne Langdon,69,"American musician, record producer and make-up artist"
Vincent Cronin,86,British writer
Virgil Akins,82,"American boxer, world welterweight champion (1958)"
Vivek Shauq,47,"Indian actor, comedian, writer and singer, heart attack"
Vítor Alves,75,"Portuguese soldier and politician, member of the MFA, responsible for the Carnation Revolution, cancer"
Wali Khan Babar,29,"Pakistani journalist, gunshot"
Wally Hughes,76,English football coach
Wayne R. Grisham,88,"American politician, Representative from California (1979–1983)"
Wenceslau Malta,79,Brazilian Olympic modern pentathlete
Wilfrid Sheed,80,"English-born American novelist and essayist, urosepsis"
Willi Dansgaard,88,Danish paleoclimatologist
William Bartley,94,American pilot
William F. Walsh,98,"American politician, Mayor of Syracuse, New York (1961–1969), Congressman (1973–1979)"
William J. Bate,76,American politician
William L. Eagleton,84,American diplomat
William R. Ratchford,76,"American politician, U.S. Representative from Connecticut (1979–1985), complications from Parkinson's disease"
William Schreyer,83,"American business executive, chairman and CEO of Merrill Lynch (1985–1993)"
William Shipley,89,"American linguist, complications of pneumonia"
William Williams,83,Canadian metallurgical engineer
Won-il Rhee,50,"South Korean digital art curator, heart attack"
Włodzimierz Ławniczak,51,"Polish journalist, Chairman of Telewizja Polska, after long illness"
Ye Peida,95,"Chinese telecommunications engineer, President of the Beijing Institute of Posts and Telecommunications"
Yosef Shiloach,69,"Israeli actor, cancer"
Zahra Bahrami,46,"Dutch-Iranian protestor and convicted drug trafficker, execution by hanging"
Zbigniew Jaremski,61,"Polish athlete, 1976 Olympic silver medalist"
Ze'ev Segal,63,Israeli jurist and legal analyst
Zeng Xianyi,74,Chinese professor of legal history
Zilpha Grant,91,British Olympic swimmer
Zoltán Berczik,73,Hungarian table tennis player and coach
Zoë Dominic,90,English photographer
Ángel Pedraza,48,"Spanish footballer and manager, cancer"
Émile Masson Jr.,95,"Belgian cyclist, winner of Paris–Roubaix and La Flèche Wallonne classic cycle races"
