Name,Age,Info
Terrence Lanni,68,"American casino executive, cancer"
Tex Nelson,74,American baseball player (Baltimore Orioles)
Theodore Roszak,77,"American scholar (The Making of a Counter Culture), cancer"
Tom Aldredge,83,"American actor (The Sopranos, Boardwalk Empire), lymphoma"
Tom Gehrels,86,Dutch-born American astronomer
Tony Stevens,63,"American choreographer, dancer and actor, Hodgkin's lymphoma"
Toyoo Ashida,67,Japanese animator and film director (Fist of the North Star)
Travis Bean,63,"American guitar maker, cancer"
Tresa Hughes,81,"American actress (Another World, Don Juan DeMarco, Fame)"
V. S. Krishna Iyer,89,"Indian activist and politician, after long illness"
Vincent Kympat,64,"Indian Roman Catholic prelate, first Bishop of Jowai (since 2006)"
Virgilio Noè,89,"Italian Roman Catholic cardinal, Archpriest of the Basilica of Saint Peter (1991–2002)"
Vladimir Kosinsky,66,"Russian swimmer, 1968 Olympic silver and bronze medalist"
Volodymyr O. Kravets,81,"Ukrainian diplomat, permanent Representative of Ukraine to the United Nations, Minister of Foreign Affairs of the Ukrainian SSR"
Wang Daheng,96,Chinese optical physicist
Warren Leslie,84,"American author, journalist and business executive"
Wes Covington,79,"American baseball player (Milwaukee Braves, Kansas City Athletics, Philadelphia Phillies), cancer"
Whetu Tirikatene-Sullivan,79,"New Zealand politician, longest-serving female member of the House of Representatives (1967–1996)"
Wilfred Arsenault,57,"Canadian politician, cancer"
William Crozier,81,Irish artist
William G. Thrash,94,American Marine Corps lieutenant general
William Hildenbrand,89,"American government officer, Secretary of the United States Senate (1981–1985)"
William Leonard D'Mello,80,"Indian Roman Catholic prelate, Bishop of Karwar (1976–2007)"
William Lockhart Garwood,79,"American jurist (United States Court of Appeals for the Fifth Circuit), heart attack"
William R. Corliss,84,American physicist and writer
Willie Corbett,88,Scottish footballer (Celtic)
Willie Fernie,82,"Scottish footballer, Alzheimer's disease"
Wolfram Thiem,55,German Olympic rower
Würzel,61,"British guitarist (Motörhead), ventricular fibrillation"
Yevgeny Lopatin,93,Russian Olympic silver medal-winning (1952) weightlifter
Yoshio Harada,71,"Japanese actor, pneumonia"
Yuri Kukin,78,Russian singer-songwriter
Zdeněk Sýkora,91,Czech abstract painter
Zurab Kapianidze,74,"Georgian actor and politician, MP (1999–2003)"
Éva Sebők-Szalay,62,Hungarian Olympic volleyball player
Şerban Cantacuzino,70,"Romanian actor and nobleman, descendant of Wallachian Prince Şerban Cantacuzino"
Ştefan Sameş,59,"Romanian footballer (Steaua București), cancer"
